id	preprotext	irony
1306	US embassy , Pakistan shows TV ads on all major channels Obama , H Clinton stress film NOT made by US govt . The film , that just will not go away .	0
1307	Regardless of facts presented that paints a clear picture of the truth , people will believe what they want to believe . TOPIC_election	0
1308	TOPIC_Romney ' s response to tradegy in Libya is proof again that he is NOT presidential material . TOPIC_moron	0
1309	Naturally I am wearing my red elephant shorts today in honor of the TOPIC_RNC2012 TOPIC_GOP	0
1310	Goin to see President Obama with the Amiga AUTHOR_TOKEN tomorrow	0
1311	Mitt romney . Represent . TOPIC_BelieveInAmerica	0
1312	Off 2 Bed TOTALLY CRANKY about the TOPIC_Quebec TOPIC_election results ! All of U that did not vote U not only screwed yourselves but the rest of us !	0
1313	Hey , when is Tebow coming out to speak ? Im starting to get bored . I was promised Tebow ! TOPIC_GOP2012 TOPIC_tampa2012 TOPIC_gopconvention AUTHOR_TOKEN	0
1314	Got my new registration card TOPIC_Obama	0
1315	AUTHOR_TOKEN excUSE U THAT IS MY PIC OBAMA IS MY PERSON OK TOPIC_obama2012	0
1316	I need to go registrar to vote TOPIC_OBAMA	0
1317	Of all the ppl I never wud have guessed she would be a TOPIC_Romney supporter . URL_TOKEN / / t.co/nr5UgfKY Get em girl ! TOPIC_RomneyRyan2012 TOPIC_nickiminaj	0
1318	She is SOO stupid . . Bachmann Ads Blast Stimulus , Tout Stimulus Projects . . TOPIC_GOP TOPIC_tcot TOPIC_Obama2012 URL_TOKEN / / t.co/Wyh2C0cK	0
1319	Mitt Romney Dont pay no tax Mitt Romney Dont pay no tax	0
1320	I think women should be trusted to make their own health care decisions-Barack Obama	0
1321	AUTHOR_TOKEN on Fox Sunday ! LOL ! I guess Wallace might DARE to say Fox News , internal Romney polls are NOT BIASED . . what bravery . LOL !	0
1322	AUTHOR_TOKEN Im Mad Cause They Shut Off The Steeler Game Yesterday For That Stupid A # % Republician Debate TOPIC_FuckinCoon TOPIC_Obama	0
1323	I do not understand how anyone could POSSIBLY PAY to see that OBAMA 'S 2016 MOVIE ! ! It is not based on ANY FACT . PROPAGANDA , PEOPLE ! ! !	0
1324	Nice finish TOPIC_riders . Nice finish . Drew Willy for mayor . TOPIC_election2012	0
1325	Will Obama fire the person responsible for this statement ? . . misguided individuals to hurt the religious feelings of Muslims	0
1326	TOPIC_obama 2012 vote or die	0
1327	TOPIC_Election day 2012 - Get out and vote ! TOPIC_OBAMA	0
1328	TOPIC_LiberationOfParis tribute to la TOPIC_Nueve , head company of General Leclerc , the very 1st to enter Paris . Almost all were Spanish TOPIC_Republicans	0
1329	AUTHOR_TOKEN if that 's what they are worried about , then I have a recommendation for a part of the gov that TOPIC_Romney TOPIC_Ryan should reduce .	0
1330	Proud to be whr im at now bc ik ihave soo much potential in life & amp & amp ppl like TOPIC_BARACK & amp & amp TOPIC_MiCHELLE TOPIC_OBAMA are what the US needs ! & gt & gt & gt & gt & gt	0
1331	TOPIC_ff AUTHOR_TOKEN and AUTHOR_TOKEN the only recognised leadership on TOPIC_TwitterMw TOPIC_King TOPIC_President	0
1332	Idk who I am gonna vote for , but I do know it will not be TOPIC_Obama . Really ? My phone just autocorrected him to capitalization , TOPIC_fail TOPIC_nobama	0
1333	Romney to pledge to fix troubled U . S . immigration system Reuters URL_TOKEN / / t . co / hubgHPpv BUT , Did He Ask TOPIC_Kobach & amp TOPIC_Nativists in GOP ?	0
1334	oh yup TOPIC_Obama ima vote to build the process	0
1335	Romney thinks that America is just another way to make money and has no business running it ! AUTHOR_TOKEN AUTHOR_TOKEN TOPIC_election2012	0
1336	Hey Fortuno -- the private sector is creating jobs here , too . 27 straight months , in fact . TOPIC_GOP2012	0
1337	AUTHOR_TOKEN back to me supporting black business . . I try . I am bout to just hang it up and say voting for Barack is enough	0
1338	President Obama Gets the Stoner Endorsement in New Harold & amp Kumar DNC Ad Video	0
1339	i havent heard back from the TOPIC_president or TOPIC_firstlady yet . truly bummed	0
1340	Consider what the world would be now if Gore 's presidency was not hijacked by Bush TOPIC_elections 2012 TOPIC_Republicans	0
1341	AUTHOR_TOKEN AUTHOR_TOKEN AUTHOR_TOKEN AUTHOR_TOKEN AUTHOR_TOKEN Concluding that everyone that sees Batman is Obama supporter is moronic .	0
1342	I do not drink because I am mormon . TOPIC_romneyryan2012	0
1343	TOPIC_Obama TOPIC_Biden TOPIC_Campaign2012 TOPIC_vote TOPIC_democraticconvention My president is awesome . TOPIC_DNC2012	0
1344	I wonder if the Obama 's ever role play as Republicans . TOPIC_obama TOPIC_republican TOPIC_democrat TOPIC_romney TOPIC_roleplay TOPIC_DC TOPIC_politics TOPIC_hashtag	0
1345	Dear TOPIC_republicans AUTHOR_TOKEN n AUTHOR_TOKEN just a reminder on who really built it . TOPIC_rnc2012 TOPIC_romneyryan2012 URL_TOKEN / / t.co/qS3TxLcJ	0
1346	AUTHOR_TOKEN played Mitt clips I had not seen . OMG it 's so much worse than I thought . TOPIC_Election2012 TOPIC_sayuncle	0
1347	So u basically called the 47 % Bums . . TOPIC_Romney its safe to say u lost the election TOPIC_4moreyears TOPIC_Obama2012	0
1348	I died last night talkin bout the tributes in HungerGames will be the TOPIC_democrats & amp the ppl watchin will be the TOPIC_Republicans if Romney wins	0
1349	Supporting Barack Obama all day ! TOPIC_TeamObama	0
1350	I do not know what would possess people to vote for Mitt Romney . . smh	0
1351	Dear AUTHOR_TOKEN ! Make it more interesting this year ! Include AUTHOR_TOKEN in your TOPIC_Election2012 polling !	0
1352	AUTHOR_TOKEN The number 1 issue SHOULD be the Supreme Court . TOPIC_Election2012	0
1353	So who has the better green credentials TOPIC_romney or TOPIC_obama ?	0
1354	Romney asks if you are better off today than four years ago - odd coming from someone who IS better off - along with much of the 1 %	0
1355	President AUTHOR_TOKEN has stepped on the stage . TOPIC_DNC2012 TOPIC_ELECTION2012 TOPIC_VOTE2012 TOPIC_FORWARD2012	0
1356	Karl TOPIC_Rove could care less if Romney loses . Either way , he 's making a killing with his new TOPIC_Superpac . TOPIC_Citizensunited	0
1357	bad enough its a white mans world no way in hell ill vote romney im straight TOPIC_straight TOPIC_obama ! !	0
1358	Gingrich Escalates Fight With Republican Rival Romney on Immigration Stand	0
1359	AUTHOR_TOKEN At least Romney 's not pretending to be the great hope . At least his politics matches his party .	0
1360	When you hear an Obama family member talk in person , and not just out of context hand selected quotes , it all makes sense . TOPIC_ObamaBiden2012	0
1361	AUTHOR_TOKEN AUTHOR_TOKEN I think you said TOPIC_VP2012 too so do not jinx yourself	0
1362	AUTHOR_TOKEN you pitch in Mr . TOPIC_president . .	0
1363	Dwight Eisenhower on C-SPAN . 1956 Republican National Convention . Interesting to watch . TOPIC_us TOPIC_america TOPIC_politics TOPIC_gop AUTHOR_TOKEN	0
1364	Big AUTHOR_TOKEN AUTHOR_TOKEN is back ! and so is his AUTHOR_TOKEN + We are on TOPIC_Isaac watch & amp gearing up for TOPIC_GOP convention AUTHOR_TOKEN	0
1365	Ryan taking off the gloves tonight . TOPIC_Election2012	0
1366	Why did not TOPIC_Romney help MA get higher then 47th of 50 in job creation while Governor ? TOPIC_msnbc2012	0
1367	Excellent panel on bipartisanship w AUTHOR_TOKEN and AUTHOR_TOKEN of Purple Nation . May we all be purple . TOPIC_compromise TOPIC_election2012	0
1368	TOPIC_gop I like erotic talking , i have a lot of nuaghty fantasies ww freecamsmax com	0
1369	has mitt romney seen the book of mormon	0
1370	Lost in the shuffle of this election year has been that the names of the candidates are Mitt and Barack . TOPIC_politics TOPIC_wtf	0
1371	Michelle Obama could be the main reason Barack gets re-elected . Very impressive speech . TOPIC_4moreyears	0
1372	Three words to describe the entire TOPIC_GOP convention Mean and demeaning .	0
1373	Do not hate . . calculate . It 's arithmetic , baby ! TOPIC_dnc2012 TOPIC_romney	0
1374	Lets all give a big shout out to Paul Ryan yall hes knows wats up TOPIC_Romney / Ryan ' 12	0
1375	TOPIC_Romney has five sons ? Im pretty sure that , statistically speaking , one of those dudes has GOT to be TOPIC_gay . Law of averages people . .	0
1376	For your morning commute FREE Large Coffee at 7 - Eleven from 6a - 10a today . TOPIC_Election2012	0
1377	AUTHOR_TOKEN Sadly these killings are a gift horse for Romney and he will use it to the max for his campaign . .	0
1378	Why are they all so extremely transparent TOPIC_politics TOPIC_campaign TOPIC_democrats TOPIC_republicans	0
1379	AUTHOR_TOKEN AUTHOR_TOKEN , Not Obama , to Blame for Divisiveness URL_TOKEN / / t.co/nVdy3lcN TOPIC_election2012 TOPIC_Independents TOPIC_moderates TOPIC_GOP2012	0
1380	I have a girl crush on AUTHOR_TOKEN gorgeous , smart and funny TOPIC_gop2012 TOPIC_rnc2012	0
1381	Barack Obama AUTHOR_TOKEN Fill in the blank If I could choose any celebrity to be my roommate it would be . TOPIC_Zillow TOPIC_rentals	0
1382	Brother jiejie , u like hulk ? iron man ? captain america or what ? Me Barack Obama	0
1383	Walkin with the key club TOPIC_president	0
1384	TOPIC_DNC conference call with the TOPIC_president is about to start in 1 minute	0
1385	Loved Michelle Obama 's speech . Great delivery too . Hoping for four more years . The others are well scary !	0
1386	AUTHOR_TOKEN I fucks wit that video and that song son , It was major . Ending it wit Obama talkin was crucial	0
1387	AUTHOR_TOKEN TOPIC_Election2012 Did the power go out at your house ? Stimulus was mentioned a bunch . Tarp was GWB and C & ampT did not get mentioned .	0
1388	Maggie Brooks and Louise Slaughter need to get off my television . Please and thank you . TOPIC_election2012 TOPIC_mudslinging	0
1389	I have 2 def Support My Big Bro Brandon / AUTHOR_TOKEN ! HELL YEAH Go Vote for HIM ! TOPIC_President He doesnt do it for himself He do it 4 the RACHETs	0
1390	This fall will cherry-pick out-of-context data 2 arrive AUTHOR_TOKEN conclusions they came to before ever looking at said data . TOPIC_election	0
1391	I hope all you niggas dats standing n line dis damn late b standin n line ta vote TOPIC_ThirstyAsses TOPIC_Obama	0
1392	People do not understand if Romney is elected there goes our medical marijuana and any chance of legalization TOPIC_fuckromney TOPIC_Obama	0
1393	I love being the new girl you can be whoever you want . AUTHOR_TOKEN say you are related to Obama-that should get you a free lunch !	0
1394	I have not even watched an hour of this and I am more sure than I was before I started President Obama will be re-elected . TOPIC_4moreyears	0
1395	With a hurricane closing in , Obama has the chance to officially declare the Republican National Convention a disaster area .	0
1396	If you walking down the right path and you willing to keep walking , eventually you make progress . TOPIC_Barack Obama TOPIC_DBA2012	0
1397	the TOPIC_Democrats include TOPIC_marriageequality in their party platform . TOPIC_LGBT TOPIC_equality	0
1398	Twitter suggested that I follow Barack Obama , the TOPIC_President of the U . S . . naw I am all set	0
1399	I wish people would leave TOPIC_Obama alone ! He is the president not a candidate so he still had duties to fulfill , he will get here when he can	0
1400	$ 1600 for a GMAT prep course should be illegal . . where 's President Obama when you need him ? But it is an investment	0
1401	Barack Obama came in offering hope and change . I believe I got more than my share of each . Do it again .	0
1402	sad how politicians of this country put their pride above the people they pretend to work for . And no , I am not talking about just Romney	0
1403	I heard Mitt Romney wants to get rid of pornography , ha ! The thought just tickles me	0
1404	The fact that there is no NHL season as of right now just makes me even more excited for the TOPIC_election debates next month . TOPIC_AllThatsLeft	0
1405	Could not give a TOPIC_flyingfuck that obama is coming to isu .	0
1406	TOPIC_CampaignChezeq im runnin for mayor of pittsburgh on ravenstahl boy TOPIC_election2012	0
1407	Together , we can send Barack Obama and John Barrow packing and make sure that America brightest days are still ahead . TOPIC_gagop TOPIC_ga12	0
1408	Not following the news is good news . Have not seen politicrap in days TOPIC_election TOPIC_bsautocalls TOPIC_theyreallbsartists	0
1409	Clinton is so right about the far right , aka the TOPIC_GOP hating TOPIC_Barack	0
1410	From all TOPIC_Democrats & amp TOPIC_Progressives to Todd Akin Please KEEP TALKING ! ! ! Akin Claims Breastmilk Cures Homosexuality URL_TOKEN / / t.co/EcmG1uiI	0
1411	AUTHOR_TOKEN thats is politically incorrect miss , everything that led up to his death were obama 's & amp bush 's calls obama didnt do it by hiself	0
1412	Great , emotional speech from Romney last night . Revealed a lot about who he is as a man TOPIC_RomneyRyan2012	0
1413	Chris Wallace had a great interview this morning with AUTHOR_TOKEN . Campaign would be wise to showcase Ann more . Great communicator . TOPIC_gop2012	0
1414	I dont believe shit TOPIC_Romney say Im Voting For TOPIC_Obama Straight Like That	0
1415	Is America being scammed by TOPIC_REPUBLICANS who are insinuating if they don get TOPIC_TAX cuts we won have jobs ? DEMAND 4 GOODS creates TOPIC_JOBS	0
1416	I 'd vote for Obama just cause he 's black . . fuck politics .	0
1417	Hey AUTHOR_TOKEN ! Don be so biased ! Include AUTHOR_TOKEN in your TOPIC_Election2012 polling ! TOPIC_p2	0
1418	people living of the goeverment fucking bums and my tax money goes for these bums , i hope mitt romney wins TOPIC_Republicans all day	0
1419	It TOPIC_Mitt be a good idea to call off the elections and keep TOPIC_Obama focussed on his work . TOPIC_whoareyoukidding	0
1420	AUTHOR_TOKEN you are the Future . TOPIC_garryjohnson TOPIC_iamlibertarian TOPIC_RonPaul TOPIC_Election2012 TOPIC_Apple TOPIC_DreamsWest TOPIC_GOP TOPIC_GOP2012 TOPIC_FuckYouTyrants	0
1421	AUTHOR_TOKEN TOPIC_4MOREYEARS ! !	0
1422	MT AUTHOR_TOKEN Romney 's TOPIC_RNCPowerGrab - What Really Happened URL_TOKEN / / t.co/AFPOgH7R TOPIC_GOP2012	0
1423	fuck the VMAs tune in on OBAMA ! ! !	0
1424	TOPIC_InMyMind Obama is the worst thing to ever happen to our country . TOPIC_Romney2012	0
1425	OBeing reduced to sum total of my reproductive organs is insulting . TOPIC_NBC TOPIC_ABC TOPIC_CBS TOPIC_CNN TOPIC_MSNBC TOPIC_NYT TOPIC_NPR TOPIC_Media TOPIC_MSM TOPIC_tcot TOPIC_p2 TOPIC_election2012	0
1426	AUTHOR_TOKEN If I did not have morals & amp values , I would say forget that . Lol ! But I do . TOPIC_Democrats	0
1427	Girl you look good , why do not you Barack that ass up	0
1428	I immediately doubt the sanity of someone who is okay with taking responsibility for all of America 's hopelessness . . TOPIC_president TOPIC_dirtyjob	0
1429	$ 60 in gas . TOPIC_RomneyRyan2012 TOPIC_wecandobetter AUTHOR_TOKEN / / just do not drive TOPIC_pragmatism	0
1430	AUTHOR_TOKEN AUTHOR_TOKEN When in doubt , Bombard a Muslim Country . . TOPIC_Quote TOPIC_Obama	0
1431	In his second term , Obama will be the nation 's first transgendered president .	0
1432	AUTHOR_TOKEN Okay . No more JB jokes . but it looks like those pictures you sent me . Hm . . Anyways . . GO ROMNEY ! TOPIC_RomneyRyan2012	0
1433	The refs from the Seattle-Green Bay game just ruled that Paul Ryan actually did run a marathon in under 30min . AUTHOR_TOKEN TOPIC_RyanAbs TOPIC_RomneyRyan2012	0
1434	AUTHOR_TOKEN I know I can not believe I made the top ten my first day of college ! ! TOPIC_4MoreYears	0
1435	Rep . McKane Flashback Angus King 's Partisan Power-Play AUTHOR_TOKEN AUTHOR_TOKEN TOPIC_election2012 TOPIC_dillforussenate URL_TOKEN / / t.co/kK9sDtpo	0
1436	hahaha what ? No guys I did not say Obamacare I said Obamaair ! * obama kickflips the whitehouse , teens vote , diseases are cured , economy has re	0
1437	AUTHOR_TOKEN Basically he 's setting up Barack for a second term , which I hope he capitalizes on .	0
1438	Will not get into why TOPIC_Obama should be re-elected , but we need 4 more yrs of his presents as TOPIC_President . He ai not superman damn !	0
1439	weird / historical for me atleast . While walking to trader joes in alexandria , va a lil girl asked me if I was just TOPIC_Barack TOPIC_Obama oo	0
1440	They go small , you go big . - Barack Obama	0
1441	TOPIC_ObamaSweatshirtSlogans Mitt Romney I do not see why you are hating from the outside of the white house , you can not even get in	0
1442	Mitt Romney sucks ass everyone in my AP U . S should know that . .	0
1443	Clinton 's purpose in helping Obama is to help Hilliary in 2016 . He sure does not like Obama .	0
1444	AUTHOR_TOKEN AUTHOR_TOKEN Y are not any of U discussing voter suppression with the GOP guest ? Maybe discuss how suppression helps Romney	0
1445	I might vote for Romney if paul Ryan 's dumbass was not on the ticket w him	0
1446	TOPIC_Obama got a 5 point bounce from the TOPIC_DNC Convention . Not even the TOPIC_KochBrother ' s billions can eradicate him from the scene ! ! TOPIC_OFA TOPIC_Romney	0
1447	I hear alot of chatter of Obama 's stats . Break down Romney stats and please talk something new besides The olympics .	0
1448	AUTHOR_TOKEN DearMrWelch , on what I just read this morning , pls support Obama , he is t better guy in all respects , also WBuffett supports him , kr	0
1449	Praying for our President Barack Hussein Obama today . . still getting chills from some of what has been said this week )	0
1450	I wish Ronald Reagan was still TOPIC_President ! By history our economy was better ! Now it sucks no presidential backbone ! Obama is a puppet !	0
1451	Maybe once in my life I will win something after donating money to the Obama Campaign ! One can only hope !	0
1452	Mitt Romney wants to ban porn . . fuck that nigga . Lmao I bet you watch it .	0
1453	Yeah . I have decided to vote this year . TOPIC_obama	0
1454	LOL at the Rolling Stone piece on Mitt Romney . .	0
1455	AUTHOR_TOKEN while some TOPIC_Republicans blame others for the TOPIC_NationalDebt and want to destroy TOPIC_Medicaid	0
1456	AUTHOR_TOKEN Mitt , your my dude . TOPIC_President2012	0
1457	Just saw another Michele TOPIC_Bachmann tv ad . They must really be worried about losing her congressional seat . TOPIC_election2012	0
1458	It kills me that ppl want to blame Obama for things that happened during the Bush administration TOPIC_ijs TOPIC_democrats TOPIC_republicans wake up ppl	0
1459	AUTHOR_TOKEN i personally think that among those on the front page of today 's TOPIC_nationpaper none deserves to be TOPIC_PRESIDENT	0
1460	I did not think I was gone vote this year . . but now I see this one really counts ! TOPIC_OBAMA TOPIC_OBAMA	0
1461	TOPIC_President to Sign Order Enhancing Mental Health Services for TOPIC_Vets	0
1462	Nursing class of 2014 if elected as your President I promise to lead with honor and insanity I mean integrity . TOPIC_nursing TOPIC_Election2012	0
1463	A Virginia man allegedly killed himself and his family last week in part because he was upset by the thought of President Barack Obama	0
1464	RIGHT SPEAK Tagg , Craig , Matt , Josh , and Ben Romney on ' Fox . .	0
1465	It seem like more white people support Obama then black people	0
1466	Michelle Obama has the best arms . Who is that woman 's trainer ? TOPIC_campaign2012	0
1467	AUTHOR_TOKEN ! Don be so biased ! Include AUTHOR_TOKEN in your TOPIC_Election2012 polling !	0
1468	AUTHOR_TOKEN Boy sound like Barack Obama	0
1469	TOPIC_Romney has decided not to repeal TOPIC_Obamacare ?	0
1470	So happy I got to see the president ! ! ! TOPIC_obama	0
1471	Dude just passed me up on his motorcycle sporting a Canadian tuxedo TOPIC_President and TOPIC_CEO AUTHOR_TOKEN	0
1472	The only thing our society can do is buy , sell , lie , and argue . TOPIC_Election2012	0
1473	I hope AUTHOR_TOKEN has registered to TOPIC_vote for this TOPIC_election and has her TOPIC_absenteeballot in on time TOPIC_romneyryan2012 TOPIC_everyvotecounts	0
1474	What ? No AUTHOR_TOKEN film for TOPIC_Election2012 ? ? ? I do not think I can get through it without one . JibJab guys please get busy !	0
1475	Here 's my film pitch Clint is a no nonsense cop days away from retirement when he 's partnered up with Barack , a hot shot transfer from DC .	0
1476	CNN uses their smart board so much , that it 's essentially become a tutorial on how to use a smart board . TOPIC_uspoli TOPIC_Obama2012 TOPIC_Romney TOPIC_fb	0
1477	AUTHOR_TOKEN I swear if I see one more thing about Obama !	0
1478	Could a hurricane disrupt the RNC ? TOPIC_GOP2012 URL_TOKEN / / t.co/ABbt8W93	0
1479	Not knowledgable with politics , but Obama 's speech AUTHOR_TOKEN the DNC was nothing short of inspring , powerful , and true TOPIC_4moreyears	0
1480	If you are not voting for TOPIC_Obama , okay fine . Just learn how to disagree in peace people ! !	0
1481	Most patriotic year ever TOPIC_RyderCup TOPIC_olympics TOPIC_election	0
1482	This convention is making me so proud to be a republican TOPIC_mitt2012	0
1483	2016 definitely makes me worry about what has / could happen but it 's still hard to believe that all of that is true . TOPIC_uncertainty TOPIC_election	0
1484	I honestly think Romney is the best choice for America right now but damn AUTHOR_TOKEN is making it hard to pull for TOPIC_Republicans TOPIC_STFU TOPIC_Haters	0
1485	Just got yelled at by the Sodexo Lady . . Apparently no one is imune to her wrath . TOPIC_Sodexo AUTHOR_TOKEN TOPIC_president	0
1486	Chef boyardee vs world hunger fuck it we feeding the world sponsored by TOPIC_Obama	0
1487	Laying in bed watching obama talk yelling at the T . V . I do not agree with anything he says . TOPIC_nobama	0
1488	If Mitt Romney gets elected , There is no hope for the USA . TOPIC_obama	0
1489	Gonna be a nasty campaign . People are cruel . TOPIC_Election2012	0
1490	While the stakes are high this TOPIC_election season , a majority of voters support Buy America preferences for public works . AUTHOR_TOKEN	0
1491	M2AF Please make sure u register 2 vote & amp make sure ur voice is heard . We can not expect change if we do not voice our opinion . TOPIC_Election2012	0
1492	Is it just me , or does Mitt Romney look like a slightly more vacant Will Ferrell ?	0
1493	TOPIC_NowPlaying TOPIC_RageAgainstTheMachine TOPIC_ForAmerica TOPIC_RomneyRyan2012 TOPIC_GOP2012 TOPIC_VoteRepublican URL_TOKEN / / t.co/995f8RPy via AUTHOR_TOKEN	0
1494	AUTHOR_TOKEN You think you know Mitt Romney ? No you do not ! Check out these 15 shocking facts about him .	0
1495	AUTHOR_TOKEN . . did Romney know he was not in Daytona FL yesterday but Dayton OH . . note jacket he wore	0
1496	High af ! ! ! . . last blunt 2 da face	0
1497	Say what u want about Bush but he sends missiles when we re attacked and Obama says he 's sorry about a movie getting out .	0
1498	Glad we will be in center for AUTHOR_TOKEN . We have fought rain all week , we will welcome AUTHOR_TOKEN like there is 60k in the house ! TOPIC_Election2012	0
1499	AUTHOR_TOKEN MITT ROMNEY TIED HIS DOG TO THE ROOF OF HIS CAR FOR A FAMILY VACATION AND DROVE LIKE THAT ALL DAY	0
1500	AUTHOR_TOKEN Great special tonight , remember GITMO closure was blocked by the TOPIC_GOP	0
1501	AUTHOR_TOKEN character witness for AUTHOR_TOKEN + TOPIC_BillClinton professional character for the President TOPIC_4MoreYears ! ! ! TOPIC_dnc2012	0
1502	Not in our entire history has one of our ambassadors been murdered / anally raped untill . 9/11 / 12 Obama partied w / jay-z , Kenya / kim , Hamas and	0
1503	TOPIC_obama use to smoke weed TOPIC_dontjudge	0
1504	AUTHOR_TOKEN emma watson , obama , and kevin jonas u gotta kill one fuck one marry one , GO	0
1505	Inspiring speech by AUTHOR_TOKEN . We need to stay the course . TOPIC_4moreyears	0
1506	AUTHOR_TOKEN And I am gonna call my father BARACK OBAMA and he gonna send yo whole family to IRAQ so try me TOPIC_TRUE	0
1507	Good luck to AUTHOR_TOKEN AUTHOR_TOKEN and AUTHOR_TOKEN in the election tomorrow TOPIC_laval TOPIC_election2012 # bestpeopletovotefor	0
1508	What ever happened to the black dude that was a republican that was gonna run against Barack	0
1509	I support helping the needy , I oppose funding the lazy . TOPIC_RomneyRyan2012	0
1510	I like Romney 5 Point Plan . TOPIC_Mitt2012	0
1511	AUTHOR_TOKEN You are an ASS ! TOPIC_GOP2012 TOPIC_Forward2012	0
1512	Tune in to the AUTHOR_TOKEN TOPIC_morningshow now ! ! TOPIC_president AUTHOR_TOKEN will be on ! !	0
1513	Saw a pretty awesome sign while door knocking today . TOPIC_Obama TOPIC_RomneyRyan2012 TOPIC_Mitt2012 TOPIC_RomneyIA URL_TOKEN / / t.co/Nkg4oJPT TOPIC_AMEN	0
1514	AUTHOR_TOKEN AUTHOR_TOKEN I love Obama and you do not get to vote for 4 more years so suck my cock . TOPIC_Obama	0
1515	Feels like fuckin fall out this morning TOPIC_Obama TOPIC_notamerica TOPIC_socialist AUTHOR_TOKEN	0
1516	OBAMA 's BITCH IS KIND OF THICK ! ! !	0
1517	HILLARY-OUS ! URL_TOKEN / / t.co/W0jl39yY NoBAMA TOPIC_DEMs will not go TOPIC_GOP ? Then , go TOPIC_ABSENTEE ! Use our links , and WRITE IN Sec'y State CLINTON !	0
1518	Tough Times do not Last . Tough People Do - - - Barack Obama .	0
1519	I do not understand why ppl are depending on one person TOPIC_President to create our jobs when we should make a stand for ourselves	0
1520	Do not forget to register to vote ! TOPIC_natlvoterreg day ! TOPIC_vote TOPIC_election2012	0
1521	AUTHOR_TOKEN AUTHOR_TOKEN yeah I do agree . Obama is not my top choice . But he tops Romney .	0
1522	How will the TOPIC_Democrats respond to TOPIC_Romney and Ryan next week in Charlotte . Mitt 's speech good but hardly spell binding .	0
1523	TOPIC_teamObama TOPIC_JohnStewart TOPIC_Democrats TOPIC_Liberals TOPIC_Forward URL_TOKEN / / t.co/yQ0lOFFo	0
1524	Raise taxes on the middle class to lower those for the upper class ? That does not sound cool , guys . TOPIC_classwarfare TOPIC_GOP	0
1525	Do not know why but I am really looking forward to TOPIC_Obama v . TOPIC_Romney tomorrow night . Can not wait for the TOPIC_debate .	0
1526	Tony for TOPIC_President . Vote for me or else . You fucking cock-a-roach	0
1527	im pretty sure TOPIC_republicans made the movie	0
