id	preprotext	irony
0	You say you want smaller gov't , TOPIC_GOP ? Get out of my uterus and stop telling people who love each other they can not get married . TOPIC_hypocrites	1
1	RT AUTHOR_TOKEN Voters Can Make an Informed Decision About Whether They Want a TOPIC_President Who Kills People VIDEO URL_TOKEN \ / \ / t . co \ / 4QnIGvFV # . .	1
2	Traditional Marriage in the good old days - trading a daughter for cows , land , or governing power . TOPIC_equality TOPIC_HRC TOPIC_obamabiden2012 TOPIC_DNC2012	1
3	people are so ignorant . You want Obama out of office so badly but yet do you even know the policies he has ? Do you even know Romney 's ?	1
4	I had the worst dream ever last night . . I was in a voting booth and I picked mitt romney ! ! ! Aaahh . TOPIC_mittromney TOPIC_republicans	1
5	RT AUTHOR_TOKEN Why do many TOPIC_Republicans have a problem with science ? Guests debate on AUTHOR_TOKEN URL_TOKEN \ / \ / t . co \ / qiaXTkbN	1
6	Liquor store owners across America are praying that all drinking games during TOPIC_GOP2012 involve a double shot each time Romney lies .	1
7	So . . the TOPIC_GOP is for limited government but an omnipotent TOPIC_RNC . TOPIC_2012 TOPIC_rnc2012 TOPIC_gop2012 TOPIC_romney	1
8	RT AUTHOR_TOKEN This TOPIC_GOP2012 TOPIC_RomneyRyan2012 lying is a new low . May it bite them all in the ass , hard , and shame them into oblivion . h . .	1
9	AUTHOR_TOKEN What difference does it make ? We are fucked either way it goes . TOPIC_Election2012	1
10	If Romney become the president its only right if I shoot his ass	1
11	After the TOPIC_Republicans burned the house down in 2008 the WRONG QUESTION to ask & gt the house in better shape now ? TOPIC_tcot TOPIC_p2 TOPIC_rebuild	1
12	Mitt Romney hates Tongans because they slaughter horses ! Lmao jk I am just trying to get Obama more votes . TOPIC_4MoreYears	1
13	TOPIC_MyHomelessSignWouldSay VOTE FOR OBAMA OR BE PREPARED TO SEE ALOT MORE SIGNS LIKE THIS ! ! !	1
14	RT AUTHOR_TOKEN RT AUTHOR_TOKEN Scandal erupts as Pres Barack Obama is exposed as a Christian who cares about minorities . TOPIC_GOP2012	1
15	Dear TOPIC_Republicans saying NO to the TOPIC_DREAM TOPIC_Act you may make a TOPIC_country full of ignorant TOPIC_people ! You really TOPIC_need it ?	1
16	The Romney convention was so white . . i had to turn the contrast down on my tv . By the way im white . . Iwas blinded !	1
17	. . RT AUTHOR_TOKEN Vote Obama ! Them other guys got hate in they blood ! I can tell from watching em talk ! ! !	1
18	TOPIC_YouJustPulledARomney if you created a giant like Staples . . and wiped out the small , family owned stationary stores . No net jobs . TOPIC_Romney	1
19	He does not even know where the water comes from during a hurricane and you want him to be President ? TOPIC_smdh TOPIC_romney TOPIC_Eastwooding	1
20	I hereby nominate AUTHOR_TOKEN for TOPIC_president of them here parts . TOPIC_butchForPresident ! ! Vote and vote often	1
21	why is everyone already saying romney will win ? am I missing something here ? do not believe it , and make sure you vote	1
22	No room for more than one zombie show on TV . TOPIC_Election2012 coverage needs to go away before the AUTHOR_TOKEN is back on in October .	1
23	Is the Innocence of Muslims film handiwork of someone in Republican party to damage Obama by proxy TOPIC_innocenceofmuslims TOPIC_Obama TOPIC_gop TOPIC_teaparty	1
24	RT AUTHOR_TOKEN TOPIC_Republicans have become the American TOPIC_Taliban . They are afraid of vaginas unless they control them because they can not control themselves .	1
25	TOPIC_romney does not like vagina or art . The 2 things that make our world go round . Art funding ! Women 's rights ! His dick is all poop covered eww	1
26	if TOPIC_romney wins the US election , i will crawl into a hole and cry for the next 4 years TOPIC_obama	1
27	My niggahs got enough white to build Barack 's house	1
28	Abeg wot do rich people eat ? If u r rich pls reply o ! This one dat Beyonce and Jay had a 4m lunch wit Obama	1
29	This country is disgusting ! ! ! TOPIC_RomneyRyan2012	1
30	What ? People are waiting in line at the MACC for TOPIC_Obama right now ? Can I have your class schedule and free time ?	1
31	Vote Obama or women will lose their rights , smallpox will come back , and an asteroid will hit the earth . It 's YOUR FUTURE ! TOPIC_Obama TOPIC_sarcasm	1
32	If mitt Romney becomes president . . I will get a tattoo of a butterfly on my stomach ! ! !	1
33	TOPIC_Republicans want a Norman Rockwell America , but we are a nation of TOPIC_Juggalos , TOPIC_Bronys & amp TOPIC_Trekkies . TOPIC_Unite4GaryJohnson & amp keep life weird .	1
34	TOPIC_GOP platform will support a human life amendment to the TOPIC_Constitution , because , you know , that 's what America 's top need is right now .	1
35	Republican & amp Democrat might be what you see . . All I see are dollar signs and greed . TOPIC_Election2012	1
36	Why would u pass a bill that will banned TOPIC_PE ? Physical activity benefits the brain . Explain this to me dear TOPIC_Republicans in TOPIC_Florida ?	1
37	obama tape comes out 5 years late . . TOPIC_obama	1
38	With modern communication the embassies are as necessary as buggy whips - Close them all and save billions . TOPIC_tcot TOPIC_teaparty TOPIC_GOP	1
39	Voting-in presidents is like signing a coach who is in the un-retired-free-agent-coach-pool . TOPIC_Election2012 TOPIC_NFL TOPIC_bummercity	1
40	if they get obama out of here they gone try to take us down cause shit gone be crazy	1
41	romney 's not lettin woman get their medical personal right or wuteva . . wth if ya vote for him , go ahead and kill ya selff	1
42	What was Clint Eastwood doing ? TOPIC_ObamaBiden2012	1
43	Daily Kos Romney 's entire world revolves around URL_TOKEN / / t.co/Azj800B0 via AUTHOR_TOKEN READ THIS ! ! Please retweet . TOPIC_ObamaBiden2012	1
44	My question is . . where were the balls and shit talking BEFORE college came . . TOPIC_Election2012	1
45	Ayye Beyonce just e-mailed me , guess I have to donate now ! TOPIC_obama2012 TOPIC_4moreyears	1
46	Amen ! If obama lose , I am packing ALL MY SHIT ! ! and moving to bikini bottom , fuck that	1
47	TOPIC_obama What sort of pleassure do guys get from fucking the other within the ass ? ? ? Better an egg in peace , than an ox in war .	1
48	Swear I should be a slogan creator for Mitt Romney .	1
49	Think I am the first ever person to stop following Barack Obama L TOPIC_ImSuchAnArsehole	1
50	How many fucking times are you going to follow and unfollow make up your mind AUTHOR_TOKEN	1
51	A ' War on Coal ' ? Seriously , TOPIC_Romney ? The miners were forced by mgmt to attend the filming of your TOPIC_desperate TOPIC_propaganda piece ! TOPIC_fraud TOPIC_GOP	1
52	Saw Fox news aired a car chase that ended in suicide . Not really surprised . They have been airing Romney 's for the last few months . TOPIC_Gop2012	1
53	Can I be Beyonce ? ? ? Why is she so perf and talented , I want compliments from Obama ! TOPIC_fml	1
54	Please stop talking about Todd Akin 's rape fantasies and refocus on me . I legitimately assault a whole government ! TOPIC_truth TOPIC_RomneyRyan2012	1
55	Really excited to watch the presidential debate tonight , I hope they start calling each other names TOPIC_debate TOPIC_election2012	1
56	I dont always attend intelligence briefings but when I do , I prefer Dos Equis . TOPIC_TheMostSophisticatedConsumerOfIntelligenceOnThePlanet TOPIC_Obama	1
57	This is Barack Obama 's sister named Jergle TOPIC_shitnobodysays	1
58	42 days left until the US TOPIC_election . . I wonder when will we start counting how many days left until we end world TOPIC_hunger . .	1
59	The TOPIC_GOP is in a Cold War Mind Warp TOPIC_DNC2012	1
60	I love how glamorous US politics is . Still full of the same twats we get over here , but with better hair and make-up . TOPIC_election2012	1
61	Neil Armstrong killed in his sleep by Mitt Romney TOPIC_NeilArmstrong TOPIC_Romney	1
62	God is just as hurt with how the TOPIC_republicans are responding to the TOPIC_democrats , as He is with the TOPIC_democrats new stand . TOPIC_love TOPIC_biggerpicture	1
63	AUTHOR_TOKEN The TOPIC_TeaParty has its hand up the TOPIC_GOP puppet hole . Republicans have a tiger by the tail . How 's that workin ' for ya ?	1
64	AUTHOR_TOKEN Obama needs to act like a Commander in Chief and deal with many hot issues in the Middle East instead of campagining ?	1
65	Mann i will tell you this . . if Barack EVER raised his voice like that to Michelle I 'd bet money she would 've Ochocinco'ed him . .	1
66	When i become tha next us TOPIC_president , am gonna put all this rude ass galz in prison . . They are mean as hell ! !	1
67	Politics , as dirty as it looks , Obama and his team are setting great examples making it look like child 's play .	1
68	Thank TOPIC_Congress for screwing TOPIC_Obama ! As long as we get our country back TOPIC_Republican it is ! TOPIC_Democrats must b on the TOPIC_Republican payroll .	1
69	Am I the only one thinkin that Stuart Stevens is secretly on Obama 's side ? Some of his decisions for the Romney campaign have been baffling .	1
70	The TOPIC_RomneyRyan2012 TV ( TOPIC_FoxNews ) howls that admin did not say it knew w / i 24 hrs that Libya attck was terrorists . Better to help CATCH them !	1
71	AUTHOR_TOKEN - that 's fair the rest of us are not satisified with Obama 's manipulated certificate of live birth .	1
72	Electronic Voting machines seem to eliminate the problem of TOPIC_writeins for both parties come TOPIC_election time . Means can not write in TOPIC_Ron Paul .	1
73	This says it all regarding the TOPIC_GOP URL_TOKEN / / t.co/prn2dBz6 via AUTHOR_TOKEN Remember kids , just say no to knowledge . TOPIC_p2	1
74	AUTHOR_TOKEN AUTHOR_TOKEN Not even TOPIC_Obama ' s laws come before TOPIC_Gods laws , do not matter that Obama is TOPIC_President . .	1
75	The TOPIC_MSNBC coverage of the repub convention makes me want to vote for TOPIC_Romney out of spite . They r so far left they make TOPIC_FOX look moderate .	1
76	Fort Collins is generally a relatively douchebag-free town . Obama coming tomorrow is gonna raise the douchebagginess ten fold TOPIC_Republicans	1
77	The chair rules you out of order , Mr . Eastwood . TOPIC_rnc TOPIC_gop2012 TOPIC_rnc2012	1
78	hmm , TOPIC_democrats seem to skew the truth to their favor while TOPIC_republicans just straight up lie . In the end . . they are all fucking liars .	1
79	The hours hookers put in at these US conventions are long and tiring but neither Romney or Obama thanked them . SAD ! TOPIC_gop2012 TOPIC_dnc	1
80	I love how republicans use a football game as political leverage , good job Ryan TOPIC_4moreyears	1
81	If Romney gets elected , the world better fuckin end in December . . I can not be a slave for 4 whole years bruh .	1
82	FED will print more money - but only AFTER the US elections . How else is Obama gonna get reelected ? TOPIC_gold TOPIC_QE TOPIC_FED TOPIC_Bernanke TOPIC_Obama TOPIC_election	1
83	It 's a bad time ? TOPIC_GOP2012 TOPIC_Romney2012 TOPIC_WeBuiltIt URL_TOKEN / / t.co/IqVQ1eW0	1
84	This is the most egregious thing I have ever heard a politician say TOPIC_Republicans TOPIC_GOP TOPIC_LegitimateRape TOPIC_IllegitimateRape	1
85	TOPIC_FoxNews just reported that even more taxpayers dollars are going to waste in Washington . Really ? This is news ? To who ? TOPIC_teaparty TOPIC_gop	1
86	Only 3 niggas ever had enuff power to get put on baptist church fans . . Martin Luther The King , Jesus . . and my nigga Obama TOPIC_4MoreYears	1
87	AUTHOR_TOKEN they need a storm in Florida because Romney 's not capable of whipping one up . A wooden candidate if ever there was one . TOPIC_GOP	1
88	AUTHOR_TOKEN please do all of us Republican 's a favor and resign your nomination . Your comments are hateful and hurtful . TOPIC_GOP2012	1
89	Malcolm X . Martin Luther King . Now Barack Obama . . black man who tried to become on top & amp change things but get stopped by white people . Smh !	1
90	Obama looks like a black version of the Mad magazine guy .	1
91	All I gotta say is why Romney take 2days to change his story . . then later denying he ever said his slogan . smh I am for TOPIC_Obama .	1
92	Mitt Romney could not be a more stereotypical republican if he tried , and knowing America that will probably get him voted in .	1
93	ObamaNation has turned into an abomination very very quickly . TOPIC_RomneyRyan2012	1
94	AUTHOR_TOKEN anyone who disagrees with pro-choice should go back to 1960 Jim Crowe laws . . Then again most TOPIC_republicans would probably like that	1
95	AUTHOR_TOKEN at least Kerry went to Vietnam . TOPIC_Romney hid in France	1
96	Conservative Catholics Where they want Latin Mass but never Latin dancing . TOPIC_paulryan TOPIC_gop2012 TOPIC_hipsswing	1
97	Code Pink already protesting in Tampa with 8 foot vagina costumes etc . TOPIC_romneyryan2012 But wouldn that offend Khamenei ?	1
98	TOPIC_Obama and TOPIC_Romney sounds rubbish , whereas Gore and Bush sounded like off-the-wall porno .	1
99	TOPIC_Romney is the punishment of the universe	1
100	AUTHOR_TOKEN Which candidate will favor Fund the Future Zakat ? Crusading Obama or Traveling Romney ? Clear as mud ! R all Christians Crusaders ?	1
101	Did Nicki Minaj really endorse Mitt Romney ? !	1
102	TOPIC_GOP features TOPIC_ClintEastwood . I expect TOPIC_Democrats to feature Gilbert Gottfried or Carrot Top	1
103	AUTHOR_TOKEN How can u support that shitty president Obama ? Are you all that stupid in California and New York ! !	1
104	This girl in my government class did not know Romney 's name today . .	1
105	Can we all agree there needs to be a complete moratorium of spray-tans on politicians ? TOPIC_tacky TOPIC_MITTROMNEY TOPIC_Election2012 TOPIC_Boehner	1
106	NOO-FREAKING-OBAMA . I swear I will move to another continent if he 's reelected . TOPIC_RomneyRyan2012	1
107	AUTHOR_TOKEN Just a few brain cells & amp they would be really dangerous ! ! TOPIC_Republicans	1
108	I love election time . It lets me realize who is stupid and needs to be deleted off my friends lists TOPIC_president2012	1
109	Why does criticizing dependency on gov't hurt your chances for Pres . while criticizing dependency on God and guns is ok ? TOPIC_romney v . TOPIC_obama	1
110	IF I HEAR ONE MORE AD FOR OBAMA OR ROMNEY I AM VOTING INDEPENDENT . I am kidding . I can not vote .	1
111	Congrats AUTHOR_TOKEN on your Membership to Augusta National . Now I know why you did not want to be the TOPIC_GOP VP Candidate	1
112	AUTHOR_TOKEN yeah AND Barack obama will be personally stealing all of them ! ! !	1
113	Sheesh ! All the DNC speakers are reciting the same handful of anti-Romney attacks like low job creation with a 4.6 % unemployment rate !	1
114	When TOPIC_democrats are in office , black ppl seem to suspend all critical thinking skills . Repubs come , the exact opposite .	1
115	Please do NOT vote for an oligarchic plutocrat with sociopathic tendancies , and do not vote for TOPIC_Romney , either .	1
116	The last time I saw a former movie icon talking to an empty chair Bruce Willis was having the worst anniversary ever TOPIC_GOP2012 TOPIC_SixthSense	1
117	Romney just end the week with continual stupidity . He says he is not qualified to be President because he over paid the IRS . Good Job Mitt !	1
118	Romney dedicated to the principle that women & amp gays need regulation , but Wall Street does not . TOPIC_GOP2012 TOPIC_Forward2012 TOPIC_genius	1
119	Wtf is a legitimate rape ? ? This is the dumbest shit I have ever heard ! ! Smh TOPIC_republicans	1
120	the guy from the movie Space Cowboy is in fact , a Space Cowboy in real life . TOPIC_Current2012 TOPIC_RNC TOPIC_clinteastwood TOPIC_election TOPIC_obama	1
121	TOPIC_Obamanomics and TOPIC_Obamacare a complete failure ? TOPIC_Election2012 URL_TOKEN / / t.co/N5fjNUn3	1
122	Realizing that politics and Facebook friendships do not mix this election season . TOPIC_election2012 TOPIC_notupforthebullying	1
123	AUTHOR_TOKEN TOPIC_Romney what ? Self Made man myth ? - like Gandhi ?	1
124	Its easy to say Americans are dependent when you have had the silver spoon in your mouth your whole life TOPIC_Romney	1
125	wasted vote would be for TOPIC_obama TOPIC_romney or TOPIC_ronpaul write-in . TOPIC_GARYJONSON2012 he 's on the ballot and he 's not older than dirt .	1
126	I love when people get mad when you express your political views . TOPIC_juststop TOPIC_freedomofspeech TOPIC_yourespectmeirespectyou TOPIC_RomneyRyan2012	1
127	I am trynna get my braces before Re election , Romney might win and fuck shit up for me .	1
128	Romney would advertise on twitter the day of the debate . He can not trend any other way . TOPIC_4moreyears	1
129	Can someone Mitt Romney I refuse to become a slave .	1
130	The bigotry of republicans is only matched by the ignorance of democrats TOPIC_Election2012	1
131	AUTHOR_TOKEN TOPIC_Election Even as a Canadian citizen I can see how bad Romney would be for your country . He would obliterate human rights .	1
132	TOPIC_RomneyRyan2012 takes away titty Tuesdays . TOPIC_ChadReed2012 wants the public to be happy . TOPIC_fuckromney TOPIC_realtalk	1
133	Obama used to smoke weed . . probably still do . . how could you NOT vote for dat nigga	1
134	Vote Barack or live under a rock LOL	1
135	TOPIC_FOCUS No one in history has ever successfully run for TOPIC_President riding this TOPIC_Big of a TOPIC_Lie ! TOPIC_MittRomney URL_TOKEN / / t.co/sXz068A7 TOPIC_p2	1
136	US media is promoting socialist society and will do whatever it takes to keep OBAMA in the office . Soviet & amp Vietnam were there once .	1
137	Now as a drinking man I want to know does Romney support absinthe ? He should . Its out of style and poisonous	1
138	AUTHOR_TOKEN lol now I hope Mr Romney gets voted in so a year from now when were in the same shitty economic position I can say ' i told ya so '	1
139	Vote Romney . Because he hates 47 % of you , and because everyone should write off their dancing horse as a tax write off of up to $ 77,00	1
140	Romney is losing in the polls but getting richer . Is that REALLY losing ? ?	1
141	AUTHOR_TOKEN how df u gon tell me im 18 Old enough to vote and I am voting for mitt Romney just because his beliefs and promises	1
142	AUTHOR_TOKEN Earth to Mitt . Nobody likes you . It just that some republicans do not like Barack Obama .	1
143	My Niggas got enough white to build Barack house	1
144	TOPIC_Romney wants to repeal TOPIC_DADT and make same-sex marriage illegal TOPIC_Obama2012 TOPIC_4MoreYears	1
145	THE BEST ten days in USVI with krys . Long day of traveling tomorrow ! TOPIC_GOPCOVENTIONWHENIGETHOME TOPIC_withmitt TOPIC_RomneyRyan2012	1
146	Cowboys vs . Giants & gt DNC convention - great planning TOPIC_DNC2012 TOPIC_Campaign2012	1
147	AUTHOR_TOKEN voting Romney over Obama is like a passenger leaning slightly to the right to help swerve a car to avoid a head-on collision .	1
148	We need a diversity in the pussy department . - Barack Obama	1
149	Things that are politically incorrect ? Democrats . TOPIC_Election2012	1
150	Gay porn If Romney wins this election , I am just going to stay inside my home and watch porn for the next four years straight .	1
151	Saw a clip from a TOPIC_Romney speaking event . Boy , that crowd sure was . . um . . pale . TOPIC_thewhiteright	1
152	I run the world like Michelle 's husband TOPIC_obama TOPIC_president TOPIC_life	1
153	If Mitt Romney Wins , does anyone know if we get to choose which Plantation we get to pick cotton from ? TOPIC_GOP2012 TOPIC_WeBuiltIt	1
154	AUTHOR_TOKEN yes . Now shut up about it or I send Mitt Romney to be king of Finland .	1
155	Why are TOPIC_republicans / TOPIC_teaparty people so fucking stupid ? TOPIC_pissedoff	1
156	AUTHOR_TOKEN You are a lunatic ! I can not to see you TOPIC_Republicans fail	1
157	If IQ is weighed per vote , TOPIC_GOP will never win	1
158	AUTHOR_TOKEN Funny . Looks like the American people are preparing to smite you libtards in November . TOPIC_romneyryan TOPIC_mitt2012	1
159	Dese niggas can not hold me back . . Mitt Romney do not pay no tax . .	1
160	Hey Obama , get your childish , lazy followers under control while Americas future vice president speaks ! TOPIC_GOP2012	1
161	Romney for president & lt & lt & lt & lt & lt & lt & lt & lt & lt I Do not FUCKING THINK SO BITCHH	1
162	TOPIC_Pointless Romney so not real to me , I can not even debate a pro Romney person . TOPIC_JOKE	1
163	Fuck the food stamps ! I am a female this man TOPIC_ROMNEY do not give a FUCK about FEMALES rights ! Fuck him & amp everything he stands 4 . TOPIC_TeamObama	1
164	I send them hoodsters through and they coming with the guns Barack killed Osama with	1
165	Whose crap do you think smells worse , TOPIC_Romney or TOPIC_Obama ?	1
166	And the fact that people think Obama gonna lose to Romney is funny af . Romney is a fuckin retard .	1
167	I am a TOPIC_Republican , but if I have to hear my mom talk about TOPIC_Romney one more time , I am going to stab myself with my bayonet .	1
168	I love starting my day with a good laugh ! Thanks TOPIC_Democrats !	1
169	I partied with TOPIC_obama last night ! Na na na na boo boo AUTHOR_TOKEN	1
170	AUTHOR_TOKEN you have my vote Bitch . Blake for president ! TOPIC_president TOPIC_2012election	1
171	Nothing in life is free you have to work hard . Unless you are a Democrat - Coach Triveri TOPIC_Republicans	1
172	TOPIC_Greenbay TOPIC_NFL The biggest Rolling Calamity since TOPIC_Romney TOPIC_SMDH	1
173	This One Year National Prayer Project , how is it going to be ? TOPIC_president ' s speech	1
174	77 days until TOPIC_election day and it does not even feel like it . . What 's goin ' on ? ! !	1
175	Everyone in southern MN AUTHOR_TOKEN is nothing more than an Obama / Pelosi / Reid radical leftist liberal . Wake up people ! ! !	1
176	Moral of the story ? TOPIC_AnnCoulter and TOPIC_Republicans fear of non-whites causes historical amnesia	1
177	More slammeD in their face too . AUTHOR_TOKEN Last week Republican volunteers knocked on more doors than in any week during ' 08 . TOPIC_RomneyRyan2012	1
178	AUTHOR_TOKEN if you can give me one good reason why the NON millionaires should vote for Romney I might give you some bars !	1
179	Just cause biden said BS , yall suppose to think that the president is some cursing machine and alcoholic ! Come on VB TOPIC_Fox25 TOPIC_republicans	1
180	any thoughts on Romney havning to get 61 % of the white votes to win .	1
181	Well Good Morning America ! Hi Ho , Hi Ho it off to work I go . Thank God Almighty I have a job no thanks to Barack Obama .	1
182	I think AUTHOR_TOKEN is right , TOPIC_47percent of people were never gunna vote for him even before that video came out . Nice pick , TOPIC_GOP2012	1
183	If Mitt Romney already once had a failed run for office , whats makes you think he will succeed this time around ? TOPIC_ObamaBiden2012	1
184	Ew . My grandma likes Romney . Ew ew ew . Am I related to her . Ew .	1
185	AUTHOR_TOKEN AUTHOR_TOKEN Obama will not . Just like he refused to with fast and furious cuz he knows holder and half the WH would be in jail !	1
186	Mitt can not hold a baby without making them cry . . TF you think he 's going to do if you all let him become President ? ! TOPIC_ObamaBiden2012	1
187	AUTHOR_TOKEN AUTHOR_TOKEN They are shaking in their boots . Change is coming in the name of Gary Johnson ! TOPIC_libertarian TOPIC_gop TOPIC_election 2012	1
188	There is just no end to the Damage AUTHOR_TOKEN has done to TOPIC_America . It 's time to kick him out of the White House . TOPIC_tcot TOPIC_gop TOPIC_teaparty	1
189	AUTHOR_TOKEN NOO . They are wrong . America would be screwed ! AUTHOR_TOKEN and AUTHOR_TOKEN all the way ! TOPIC_forward TOPIC_ObamaBiden2012	1
190	Who cares about that convention shit . . TOPIC_OBAMA	1
191	Why is it every presidential TOPIC_election I feel like I am trying to decide between the Bloods or Crips ?	1
192	Why are you cheering ? Be honest . Do any of you attending the TOPIC_RNC really need a job ? Really ? TOPIC_GOP2012	1
193	AUTHOR_TOKEN yea obama is great . . they both suck !	1
194	Mitt Romney moved so far to the right that he chose a running mate that solidified anti women legislation and continues lie to Americans	1
195	The reason our economy is so f-d up is cause President Obama 's black ass is spending all our hard earned tax dollars on stippers and crystal	1
196	Hey TOPIC_Liberals ! Is it time for the Appeaser in Chief TOPIC_Obama to call NASA 's Buzz Aldrin in to fix the Embassy crisis ? URL_TOKEN / / t.co/V5nr5bFC	1
197	AUTHOR_TOKEN definitely - his ancestors were KK members and he 's extremely racist as are most TOPIC_Republicans	1
198	So who plans to have a political convention in Florida during hurricane season ? TOPIC_GOP TOPIC_issac TOPIC_duh	1
199	Hey AUTHOR_TOKEN have not heard your name yet in 2012 TOPIC_citysc election discussion . Are you not running or leaving us in suspense ? TOPIC_4moreyears	1
200	AUTHOR_TOKEN it 's taken 4 years for economy to fall more than it already was and it 's gonna take 20 more years for us to recuperate after Obama	1
201	Mitt TOPIC_Romney even looks like a bad car salesman . If you are buying his shit , you truly have no sense ! TOPIC_Obama TOPIC_4MoreYears	1
202	AUTHOR_TOKEN did not really happen . . he has been dead for years before that . . its was just a political tactic for TOPIC_Obama . .	1
203	Do not Be Mad When TOPIC_obama loose . . Just Go Beat Your Friend Ass Who Talking About They Aint Gone Vote . .	1
204	I wonder if the Ron Paul delegates are going to just cave let Romney 's people roll them at the convention ?	1
205	At breakfast & amp this old man just call Obama a terrorists . WTF ! TOPIC_VOTE cause his crazy ass will . Last_day_2 register Oct . 9 TOPIC_HATER TOPIC_4MoreYears	1
206	if you are voting for romney you probably also wanted alex to win the wizard competition	1
207	AUTHOR_TOKEN LOL . And you think there are NOT people that like entitlements and gov dependency who will vote for Obama no matter what ?	1
208	Nothing on tv except the RNC . Perfect night to read that lame business book for work . TOPIC_4moreyears TOPIC_obama	1
