id	preprotext	irony
866	Remember Ben laden is gone , sadam is gone , who were ur president when all that happen . . \ rProtect and serve . . \ rBARACK HUSSEIN OBAMA JR \ rVOTE YA	0
867	AUTHOR_TOKEN I love Obama ! ! & lt3 Do not FIRE OBAMA , stop Mitt Romney ! ! ! TOPIC_4moreyears & lt3	0
868	VOTE Kaysie Procko for the class of 2015 TOPIC_president )	0
869	Obama wants to help all these other countries and borrow money from them but i think he should focus on the people first	0
870	From what I hear from Romney / Ryan want to take women back when women had few rights . Barefoot & amp pregnant ? Their ideology ? Sounds like it .	0
871	Miguel is a bad bad bad man . . so he likes other guys . . so wat ? Beyonce and Michelle Obama also like guys . . big deal . .	0
872	TOPIC_election day needs to hurry up and get here so I can get moving . TOPIC_freezing	0
873	the Romney administration has to be the poorest most inconsistent presidential campaign in the last century . TOPIC_republicans TOPIC_sad	0
874	Debt Of America smh - George W . Bush 86 % - Barack Obama 50 % - Ronald Reagan 186 % TOPIC_FoodForThought	0
875	Waiting to see this interview with TOPIC_Obama	0
876	Remind TOPIC_Democrats & amp TOPIC_Republicans they take our votes for granted election after election . TOPIC_Unite4GaryJohnson AUTHOR_TOKEN TOPIC_tlot TOPIC_ronpaul	0
877	Dear Obama and Romney campaigns - to answer your question yes , I am better off than I was 4 years ago , so . . TOPIC_4moreyears	0
878	I hope every 1 that camped out overnite 2 get the new TOPIC_iPhone5 will also camp out 2 cast their vote this Nov . ! TOPIC_4moreyears TOPIC_Obama / Biden	0
879	Sorry . It 's not just hypocrisy - it 's flat out lies . Check your facts , TOPIC_GOP . You can not fool us anymore ! ! ! TOPIC_Obama2012 URL_TOKEN / / t.co/C4HU8bIF	0
880	AUTHOR_TOKEN At the end of the piece she had to bring up Romney 's dog on the roof of the car . She left out Obama eating the dog . That 's OK .	0
881	Vice President Biden and wife Jill will return to TOPIC_NH for events on the 21st and 22nd of this month . AUTHOR_TOKEN TOPIC_Election2012	0
882	not going to let our campaign be dictated by fact checkers , - Romney pollster Neil Newhouse .	0
883	Last ounce of courage . Is a good movie got me fired up AUTHOR_TOKEN TOPIC_tcot TOPIC_GOP2012	0
884	If Mitt Romney can get NW to cancel classes , then he can get stuff done TOPIC_RomneyRyan2012	0
885	TOPIC_GOP2012 I love AUTHOR_TOKEN great speech tonight ! ! TOPIC_DNC	0
886	AUTHOR_TOKEN I see ! haha TOPIC_Forward2012 TOPIC_Obama2012 TOPIC_4moreyears	0
887	AUTHOR_TOKEN You might be surprised to learn that Barack Obama sued Citibank in 1995 to increase home ownership to those that could not pay .	0
888	Independent Analysts TOPIC_Romney ' s plan to balance the budget deemed mathematically impossible without raising middle class taxes TOPIC_RNC2012	0
889	I am with AUTHOR_TOKEN in 2012 . Here 's a photo showing my support . Check it out ! TOPIC_mitt2012 TOPIC_withmitt URL_TOKEN / / t.co/Paeydp21	0
890	Mitt Romney at UNLV today TOPIC_republican TOPIC_party	0
891	Mitt TOPIC_Romney ' s chances are getting smaller and smaller by the day	0
892	I am a republican ( in the get rid of the monarchy way , not TOPIC_GOP ) but the BBC should hang it 's head in shame at reporting this Harry rubbish	0
893	AUTHOR_TOKEN Also shows world the type of leader TOPIC_RomneyRyan2012 would be . His disastrous trip overseas gave deep insight . TOPIC_uglyamerican	0
894	Obama bring tears to my eyes , I never thought this moment would come when we will have a black president . TOPIC_TeamObama TOPIC_4MoreYears	0
895	AUTHOR_TOKEN Who will get your vote at the elections ? Barack Obama or Mitt Romney ? Please tell me , I am one of your biggest fans & lt3	0
896	AUTHOR_TOKEN OK - but Clint Eastwood miming slitting someone 's ( Obama 's ? ) throat was more than sad , and met with no opposition from TOPIC_GOP .	0
897	USA has 32 gun homicides per day very sad regulate TOPIC_obama TOPIC_romney	0
898	I have honestly goota say , I do not like what I see at all for this next TOPIC_election ! TOPIC_dumasses across the board	0
899	AUTHOR_TOKEN vs . AUTHOR_TOKEN for man of the year ? Chipper hands down ! It is evident he knows how to lead , as for TOPIC_Barack , not even close !	0
900	I am ready for the debates . I need to continue my economy and foreign policy research so I can be informed when I talk shit . TOPIC_Election2012	0
901	The conspiracy where Obama 's AMA session was really just Watson crowd-sourcing answers based on existing Reddit content . TOPIC_CalledIt	0
902	AUTHOR_TOKEN , you have great hair . TOPIC_romneyryan2012	0
903	TOPIC_romney Mama mia those hotty italianss	0
904	Neither Dem nor Rep - nor Muslim - is reliable voice on Jesus ' politics . MT AUTHOR_TOKEN the TOPIC_GOP of today is the antithesis of TOPIC_Christ .	0
905	Voting is a nonviolent act that every one of us can exercise to create social change . TOPIC_socialjustice TOPIC_civilrights TOPIC_democracy TOPIC_election	0
906	So AUTHOR_TOKEN and I will be heading to the TOPIC_gop2012 convention in Tampa . We will have reports all week long . Stay tuned !	0
907	ahaah these TOPIC_Obama & ampRomney pictures be having me laughing !	0
908	AUTHOR_TOKEN because Barack and his goons would rather focus on solar energy or keeping millions of people on welfare . TOPIC_sad	0
909	Excited to watch the presidential debate tomorrow night . Let us be real , this was the real reason we came to Georgetown . TOPIC_election2012 TOPIC_DC	0
910	Obama is ONE POWERFUL MAN - - Gabriella ( AUTHOR_TOKEN )	0
911	Just watch the Obama commercial saying he has pulled us out of debt yet at the bottom of the screen he 's still asking for donations TOPIC_wow	0
912	Man , can not wait for the presidential debate tomorrow . I really wanna watch Romney debate .	0
913	mitt romney is so cute and Obama looks like a guy who would kill santa claus in a christmas movie	0
914	TOPIC_obama needs another 4 yrs 2 clear things up . They gave bush 4 more yrs & amp he killed the economy while getting rich . Remember TOPIC_halliburton .	0
915	once again 140 characters are not enough . i want to rant about how shitty romney is as a candidate and as a person .	0
916	So I was just gonna make fun of people hating on Obama supporters , but I decided to not give the trolls what they want .	0
917	i very much dislike stupid hypocrites . . * cough * TOPIC_republicans * cough *	0
918	AUTHOR_TOKEN Obama may very much like Reagan , but comparing their fiscal track records makes it very clear that there is nothing to compare .	0
919	AUTHOR_TOKEN AUTHOR_TOKEN Like it or not TOPIC_Romney has an inability 2 follow affect like others . Ann 's speech could not fix that huge flaw .	0
920	What 's at stake this TOPIC_election key issues at hand URL_TOKEN / / t.co/XSHr070z	0
921	Darden GR headed to TOPIC_GOP2012 and TOPIC_DNC2012 - look for updates about our political convention activities .	0
922	Clothes set out . Lunch packed . Braids done . Camera charging . EVERYTHING labelled . Time to cry myself to sleep . TOPIC_mamasnotready TOPIC_4moreyears	0
923	congratulations to the first black president TOPIC_barack ' o'flackaflame	0
924	AUTHOR_TOKEN The appropriate toy 4 Romney is not an Etch A Sketch its Silly Putty . He will take on any form given to him by a misguided GOP .	0
925	i do not like mitt romney 's haircut .	0
926	If Sister Simone Campbell and Bishops are on Obama 's side TOPIC_republicans need to see that Jesus would be a TOPIC_Democrat ! !	0
927	We toke care of business in 2008 now it 's time to do the same in 2012 ! ! TOPIC_4moreyears TOPIC_ObamaorDie ? Obama accomplishments ?	0
928	Thinking about Mitt Romney running my country terrifies me .	0
929	Actually , Elizabeth Warren - that is not THIS TOPIC_Republicans mindset . I want everyone to get their fair share .	0
930	I wish I could get my tattoo with my sister right now TOPIC_4MoreYears	0
931	TOPIC_DowntownMiami until 430 p . m . today , Metrorail suspended related to President Barack Obama visit to the University of Miami	0
932	It 's 2012 , if you are running for TOPIC_President or any elected office you must assume you are being recorded at ALL times . TOPIC_Election2012	0
933	I wouldd rather hang with Obama than be at work right now TOPIC_fml	0
934	Barack Obama booked almost every seat for a Two Door Cinema Club gig , he 's got good music taste .	0
935	We take care of those coming up after us . We leave no one behind . We pull each other up . We do not turn back . - Obama AUTHOR_TOKEN TOPIC_Obama TOPIC_JayZ	0
936	America 's gun dealers are prepping for the biggest event of their year Whether Barack Obama is elected or not TOPIC_IamanAfrican	0
937	lies are more entertaining so they are more likely to spread exponentially and truth linearly i heard that from TOPIC_obama after his TOPIC_KKK rally	0
938	Whatt Do Nicki minaj dumb as be saying wtf u need to take some of that fat from yo ass & amp put it 2 yo brain . Maybe that would help . ! TOPIC_obama	0
939	God Bless America ! Vote for TOPIC_Mitt2012	0
940	Mitt Romney should have his own top 25 countdown for outrageous / stupid comments	0
941	AUTHOR_TOKEN EVEN BARACK OBAMA MUST BE EXCITED . OMG I Can not WAIT !	0
942	Clint may be onto something . I just gave my loveseat an earful and it felt pretty good . TOPIC_rnc TOPIC_gop TOPIC_chairyelling	0
943	AUTHOR_TOKEN AUTHOR_TOKEN Go Rand Paul bragging on Romney . . yeah that right . . he 's MY senator ! ! whoohoo	0
944	TOPIC_loyolaclass2016 vote for Craig MacAdams for president ! TOPIC_election TOPIC_nobettercandidate TOPIC_sga	0
945	TOPIC_GOODasks Wanna hear TOPIC_obama speak to TOPIC_sovereignnations and reaffirm relations and Trust responsibilities TOPIC_nativeamerican	0
946	I want to move to the south right meow TOPIC_4moreyears	0
947	thanks to NAACP for finding me and mailing me my new voter registration since I moved . Can not wait to vote for AUTHOR_TOKEN . TOPIC_4moreyears	0
948	FUCK TOPIC_REPUBLICANS yeah I said it	0
949	Ann Romney is not meant for public speaking . TOPIC_campaign2012	0
950	i have so much to tell Barack Obama and i am finally gonna have a chance to tell him .	0
951	The picture of Beyonce , Barack Obama , and Jay Z is so legendary . I had to make it my background . .	0
952	Statistically speaking gay Americans R better employed and wealthier so technically 1/10 citizens will be voting on equality stance TOPIC_GOP2012	0
953	AUTHOR_TOKEN Pretty funny , they are killing Mitt Romney . LMAO ! ! !	0
954	Roll on Autumn ! TOPIC_AmericanElection TOPIC_Obama TOPIC_MittWRONGney	0
955	Can the RNC get a leader Romney and McCain Why not just hand the elections to the Democrats ! TOPIC_needaleader TOPIC_republicans	0
956	Just watched Bill Clinton 's speech . TOPIC_wow TOPIC_blownaway TOPIC_Obama	0
957	The Mockers - REPUBLICAN GIRL URL_TOKEN / / t.co/doBByuc5 Cant argue with fact . Republican Women are hotter than Democrats . TOPIC_GOP2012	0
958	AUTHOR_TOKEN ) Had the kid feeling like she just ran into TOPIC_OBAMA . It 's always a pleasure running into him . . & lt3	0
959	Thank you ! MT AUTHOR_TOKEN Great speech for TOPIC_RomneyRyan2012 Cathy ! I thoroughly enjoyed visiting TOPIC_WA05 in 2010 , it 's beautiful !	0
960	being at william & amp mary makes me so excited for college TOPIC_4moreyears	0
961	Honestly think America would benefit from a multi party system of parliamentary , representative democracy TOPIC_election2012 TOPIC_politics	0
962	Do People Follow Barack Obama Because They Support His Political Career , Or Just Because He 's Barack Obama ?	0
963	We are offering a TOPIC_free kookaburra TOPIC_cricket bat to our TOPIC_followers . TOPIC_retweet Retweet this . TOPIC_greatcompetition TOPIC_GOP2012	0
964	AUTHOR_TOKEN when SHOVEL ready . . ISNT . TOPIC_obama TOPIC_congress TOPIC_legislature	0
965	Great reality T . V . editing throughout Barack 's speech . Iran looked pissed . TOPIC_Obama TOPIC_UN	0
966	I would pay good money to be in the AUTHOR_TOKEN writers room right now . O M G TOPIC_ThingsThatNeedToHappenNOW TOPIC_GOP2012 TOPIC_Election2012	0
967	AUTHOR_TOKEN The stories I want to see are about women 's rights , strategy to regain the House , and 4 years of change . TOPIC_Obama / Biden 2012	0
968	TOPIC_Obama & amp TOPIC_Romney have officially begun the race for the TOPIC_WhiteHouse . Read TOPIC_TGJ13 for an analysis of their expected foreign policies . TOPIC_Israel	0
969	4 years ago losing 800,00 jobs / month , now gaining jobs every month for 30 straight months TOPIC_4moreyears TOPIC_staythecourse	0
970	I overheard two older white men saying Obama was on their hit list	0
971	Six weeks until TOPIC_election day . Who will win ?	0
972	About as good an explication of the Republican base as i have read . URL_TOKEN / / t.co/ivXi5NHq via AUTHOR_TOKEN TOPIC_DNC TOPIC_GOP	0
973	there is a Romney booth on campus I am thinking about bum rushing the shit out of it and trashing the place	0
974	I am officially a Registered Voter ) TOPIC_Obama TOPIC_2012Election	0
975	Fantastic speech by Obama at the TOPIC_DNC2012 . Could not hope for a Democratic victory more .	0
976	Watching President AUTHOR_TOKEN on Letterman . . I would love to have a beer with Barack . .	0
977	TOPIC_BETNewsPoll shows African-American voter support for AUTHOR_TOKEN at 2 % . Why is it so low ? URL_TOKEN / / t . co / voBQqMCx TOPIC_BETRNC TOPIC_GOP2012	0
978	TOPIC_gop2012 Enjoy live free cam chat , watch sex show of live college girls ww FreeCamsMax com	0
979	AUTHOR_TOKEN hey coward - u got the guts to bring up the issue of the day , i . e . romney going birther ?	0
980	Class cancelled Thursday because Obama hehe love it	0
981	Saw President TOPIC_41 and TOPIC_43 today at AUTHOR_TOKEN , even saw Rev Jesse Jackson , guess TOPIC_democrats do not support the biggest golf event in the land !	0
982	Facebook is top advertising publisher for AUTHOR_TOKEN AUTHOR_TOKEN uses less Facebook , more Yahoo ! sites TOPIC_election2012	0
983	Here comes Bubba ! TOPIC_DNC2012 TOPIC_BillClinton TOPIC_ObamaBiden2012 TOPIC_p2	0
984	im voting Obama again . all this republican shit is gettin weirder and weirder	0
985	Omg , I literally drove around for an hour listening to politics . . TOPIC_RomneyRyan2012	0
986	finally catching up all the speeches from the DNC this week TOPIC_4moreyears	0
987	That government class is about to start TOPIC_REPUBLICANS & gt all	0
988	The future belongs to young people with an education and the imagination to create . TOPIC_Obama	0
989	Cool I got to listen to Obama talk today he 's so great omg	0
990	Obama * is * lying when he tells you that , AUTHOR_TOKEN . There is only delay .	0
991	nf AUTHOR_TOKEN & lt - - hilarious . . TOPIC_gop2012	0
992	Romney delegate TOPIC_gop2012 only ceremonial coronation of TOPIC_Romney . Asked why we are in tampa ? Moneymessage .	0
993	So sick of seeing TOPIC_republicans on tv already .	0
994	AUTHOR_TOKEN it 's what I do on a daily basis ! TOPIC_mrmotivator TOPIC_barack	0
995	today i was watching CNN and our debt has grown since 2010 by about 30 percent . . we need a new president TOPIC_romney	0
996	George Foreman 4 TOPIC_President .	0
997	MT AUTHOR_TOKEN TOPIC_Romney ' s mom on George Romney 's Mexican refugee past . Mitt 's father 's dependence on welfare . TOPIC_Democrats sound like . .	0
998	Romney should go to Chicago now and out-flank obama , like when he went to Louisiana after Isaac .	0
999	So sick of all the Obama people on campus . Please get out of my way	0
1000	AUTHOR_TOKEN I am not worried about the pain , it 's about professionalism until Nov . That 's why all the goals start in Nov . TOPIC_election2012	0
1001	Uu yes . Captain Jack / Barack Obama fan fiction . This is a thing that exists .	0
1002	TOPIC_CorporateMedia Fails to Separate TOPIC_Fact from TOPIC_Fiction at TOPIC_GOP TOPIC_Convention URL_TOKEN / / t.co/iH6NMNPK	0
1003	TOPIC_election day in TOPIC_hongkong people are using various hash tags but TOPIC_legco2012 seems to be the one specific to today 's event . TOPIC_legco TOPIC_westhk	0
1004	AUTHOR_TOKEN The story is the embassies and Obama 's policies . Romney '' s reaction is a footnote . The Dems in MSM flipping that is a big deal .	0
1005	Sending my registration form TODAY ! TOPIC_obama	0
1006	Change goona come like Barack said money power respect like the Lox said	0
1007	I hate TOPIC_election years . Keep your ads off TOPIC_youtube !	0
1008	Some people can not handle the truth , you can tell by vile crap spewing from their mouth after the facts are given . TOPIC_truth TOPIC_RomneyRyan2012	0
1009	AUTHOR_TOKEN oh she is well acquainted with mr barack Oboner	0
1010	AUTHOR_TOKEN AUTHOR_TOKEN AUTHOR_TOKEN AUTHOR_TOKEN AUTHOR_TOKEN AUTHOR_TOKEN AUTHOR_TOKEN AUTHOR_TOKEN Hi , R Bruce & gt thanks .	0
1011	TOPIC_republicans & amp TOPIC_democrats and TOPIC_independents alike ! ! ! Register to VOTE today ! ! ! Stand up for YOUR beliefs ! TOPIC_vote TOPIC_2012election	0
1012	TOPIC_obama How freaking exciting is this ? ? Make the cap fit the head .	0
1013	Will be interesting to analyze how TOPIC_Twitter impacted viewership 30M watch Romney 's speech , down from 08 URL_TOKEN / / t . co / zDdKwrqG TOPIC_election2012	0
1014	The New York Times ( USA ) mantiene enorme ventaja en dinero sobre Obama	0
1015	AUTHOR_TOKEN Re Obama . I love him I love him I love him I love him . That is all .	0
1016	EXCELLENT POINT How was George TOPIC_ROMNEY able to run for TOPIC_Prez when he was born in Mexico ? TOPIC_Mitt said his dad was born in Mexico	0
1017	So disgusted with both political parties . Both Obama and Mitt make me sick .	0
1018	Obama is coming to my school today and I will not even be able to hear him	0
1019	I missed the TOPIC_DNC but from what I have read AUTHOR_TOKEN gave a really good speech ! ! ! TOPIC_4MoreYears	0
1020	TOPIC_Obama should bomb TOPIC_Iran , NOW ! Iran must NOT have nukes ! It executes child rape victims 4 ' adultery ' ! It is NUTS ! ! !	0
1021	Best moments from presidential debates TOPIC_election2012 URL_TOKEN / / t.co/wND8gFMV	0
1022	It never ceases to depress me that some people can not condemn the deaths of innocent ppl without a follow-up caveat TOPIC_morsi TOPIC_karzai TOPIC_Romney	0
1023	When Mitt Romney thinks what you said is offensive and wrong , You are WRONG . ( Looking at you , Todd Akin . )	0
1024	Barack Obama lowkey DISSED Nicki Minaj about that Mitt Romney comment ! she say	0
1025	Frank Luntz on channel 4 news talking on the election TOPIC_Romney	0
1026	The rain is not stopping us in the Bluegrass on this TOPIC_SuperSaturday ! Come out to a victory office and volunteer for the TOPIC_election2012	0
1027	Forget Tmac I am running against him ! ! TOPIC_MARKIE TOPIC_2036 ! ! For TOPIC_PRESIDENT ! ! !	0
1028	Stop in the middle of NOwhere Iowa & amp all booked hotels bc Obama is in town ? ? ! That was unexpected ! Wish it was Romney ! TOPIC_RomneyRyan2012	0
1029	AUTHOR_TOKEN we are the 47 % ! and proud . AUTHOR_TOKEN has it in the bag . maybe AUTHOR_TOKEN can do AUTHOR_TOKEN sometime . TOPIC_4moreyears	0
1030	Good shit jacks ! ! ! Love you all Wilder for TOPIC_president ! ! !	0
1031	What do you mean the bus is not going that way today ? ! Oh yeah Obama is coming TOPIC_president TOPIC_iowastate	0
1032	TOPIC_Bounce TOPIC_Bounce TOPIC_Bounce CNN Poll TOPIC_Obama up six points over TOPIC_Romney . URL_TOKEN / / t.co/t4uWxWUn TOPIC_CNNelections	0
1033	Shoutout to AUTHOR_TOKEN for bringing us a Romney sign for the house TOPIC_RomneyRyan2012	0
1034	Literally dreading campus tomorrow TOPIC_obama TOPIC_president TOPIC_craziness	0
1035	AUTHOR_TOKEN AUTHOR_TOKEN Keep up the good work ! TOPIC_Election2012 TOPIC_UnitedStates	0
1036	I feel like I am the Obama of my people sometimes	0
1037	AUTHOR_TOKEN stop mumbling about the rich on TV . You r sounding like Obama and creating class envy and hatred . Change the laws . Capitalismwins	0
1038	the TOPIC_republicans always have been bigott ! preaching moral to the people and behave as immoral as possible !	0
1039	Paul Ryan for President ! ! ! TOPIC_President TOPIC_PaulRyanVP	0
1040	Just got in my first political debate ever and def shut some biddie up ! TOPIC_Obama TOPIC_progay TOPIC_democrats TOPIC_WIN	0
1041	If only we could re-elect Bill Clinton back to the White House TOPIC_election2012	0
1042	I know that it is TOPIC_election2012 season but do not let your political ideals mix in with your job . It could be ugly	0
1043	TOPIC_BarackObamaIs The President Of The United States & amp Should Be For 4 MORE YEARS TOPIC_OBAMA ! ! !	0
1044	This is not a subtle petition for change . This is a serious call for action . Make TOPIC_opportunity for young adults a priority in TOPIC_election2012	0
1045	That was an unbelievable speech by Julian Castro . Can you say presidential nominee in 2016 ? Um , I can . TOPIC_DNC TOPIC_Campaign2012	0
1046	Some TOPIC_politicians kuiba kura in every TOPIC_election year TOPIC_whodoesthat ? Shame on em , AUTHOR_TOKEN AUTHOR_TOKEN	0
1047	Political debate w the kids , Ben , and Dom n babes . Sorry i am a proud republican woman . TOPIC_Mitt2012	0
1048	Enough white bricks . . To build barack 's house . - tunchi	0
1049	If Romney gets elected and Bibles start disappearing I know what time it is lol . Do you ? ?	0
1050	AUTHOR_TOKEN OMG ROMNEY 's WORTH 150K HiS CAMPAIGN . . HIS POCKET EVEN ROMNEY . . IN ROMNEY	0
1051	TOPIC_GOP I says ( 2parents ) dad wurkin 2jobs mum at k mert Me Mom ( waitress Pops cook - us broke 80s TOPIC_REAGANOMICS TOPIC_CRACK ERA TOPIC_AIDS TOPIC_mmmerKKA	0
1052	The end of Pres . Clinton 's speech at TOPIC_DNC2012 drove a higher Tweets-per-minute peak ( 22,087 ) than AUTHOR_TOKEN at TOPIC_GOP2012 ( 14,289 )	0
1053	God bless Mitt Romney ! TOPIC_FOX TOPIC_newgirl TOPIC_FOXNEWS TOPIC_republicans	0
1054	Im going to make an TOPIC_Obama poster and stand infront of the arena TOPIC_ucf	0
1055	I can confirm that Cardinal Dolan met Clint Eastwood tonight TOPIC_GOP2012 TOPIC_Tampa2012	0
1056	I was laid off . . not the good layed . . Stay assholes my friends . . Obama ai not gonna help you !	0
1057	Mitt Romney said he is going to look out for African Americans . . TOPIC_Liar	0
1058	In Jamaica , do not call Obama a chair . Just talk about gettin jiggy with it .	0
1059	AUTHOR_TOKEN TOPIC_Obama to TOPIC_Assad Kill as many as you want but do not mess up with the Chemicals TOPIC_Syria	0
1060	Listening to gun right advocates in Texas , yelling at Obama for plans he does not have with facts are not there . TOPIC_Obama TOPIC_Democrats TOPIC_logic	0
1061	I never cared about politics until AUTHOR_TOKEN told me TOPIC_cosmo says TOPIC_romney wants to ban abortions n not have insurance cover birthcontrol	0
1062	ALSO S / O 2 THE PRESIDENT ( SEAN PITT NOT OBAMA ) . ACTUALLY S / O TO BARACK FOR THAT MATTER	0
1063	AUTHOR_TOKEN obama isnt pro choice . .	0
1064	AUTHOR_TOKEN Wow , you must not be a very smart person . Maybe you 'd have more in your bank acct if we had a better president . TOPIC_RomneyRyan2012	0
1065	TOPIC_Somali TOPIC_president says he will prioritize TOPIC_reconciliation , TOPIC_security & amp promises to work with international community	0
1066	Waking up for the TOPIC_gop TOPIC_RNC2012 this is way to early !	0
1067	Barack Obama cares for the United States ! . . Mitt Romney just wants to get the First BLACK president out of office ! . TOPIC_TheWorldWeLiveIn	0
1068	Anyone else find it weird I get excited about stuff like the RNC tonight ? TOPIC_polisciprobs TOPIC_election2012 TOPIC_nerd	0
1069	TOPIC_Romney wants to dismantle culture because its the quickiest way to control people basic History	0
1070	It is important to show Christ 's love for all people not just TOPIC_Republicans or TOPIC_Democrats . . Love just the same . . & gt3	0
1071	If the TOPIC_republicans had their way there will be no GM Ford or Chrysler today	0
1072	Media bias in this country insulting 2 principals of journalism . Americans smart , see it 4 what it is TOPIC_RomneyRyan2012 URL_TOKEN / / t.co/ni9oCg1i	0
1073	AUTHOR_TOKEN House passed Buffet Rule Act today open up your chk book b4 poking Romney who has done more 4 ppl than you ever will	0
1074	Guard against the impostures of pretended patriotism . George Washington TOPIC_Quotes TOPIC_Election	0
1075	Only just finished Michael Lewis ' AUTHOR_TOKEN piece . Found it quite moving . I am so proud that Barack Obama is our president .	0
1076	Let the vote counting begin ! TOPIC_election	0
1077	oh shit my son barack got bill clinton on the campaign commercial lol	0
1078	. AUTHOR_TOKEN Sen Reid is not running for president of the U . S . His constituents can take that up w / him . TOPIC_Romney needs to release his returns .	0
1079	Presidential Rolex I call that shit TOPIC_Barack !	0
1080	Lmao colored folk crack me up with this Obama stuff ! ! But we just love our President ! !	0
1081	Looking forward to starting this next two weeks strong . Bring it on TOPIC_GOP2012 ! ( Follow AUTHOR_TOKEN for convention updates from our team )	0
1082	They need to switch sides , and give those speeches at each other 's conventions . Only Barack is that trill tho .	0
1083	AUTHOR_TOKEN I have not bene this happy in ages ! 4 years has gone very slowly ! TOPIC_4moreyears TOPIC_PinPin	0
1084	We in Dayton Ohio about to see how they represent Stillman v Central State . The 1911 Obama Bus tour TOPIC_4MoreYears Barack Obama	0
1085	The TOPIC_DNC are equally to blame for the economic meltdown we experienced from 2006-2008 . TOPIC_GOP needs to stress that against the liberals . TOPIC_tcot	0
1086	I TOPIC_nominate Barack Obama because I trust him and the Dems more with America 's future than the GOP . The GOP left me a decade ago . TOPIC_DNC2012	0
1087	TOPIC_Sexy TOPIC_Top TOPIC_News Obama , Romney Rivals with little personal history / t.co/5NJJBOwy TOPIC_F4F Aoo	0
1088	Fuck you , your girly ass music , your shit ass car and your Barack Obama sticker .	0
1089	TOPIC_tlot TOPIC_tcot TOPIC_gop When Romney tries to undermine the President in a time of crisis he is not just undermining Obama but also undermining USA .	0
