id	preprotext	irony
416	I need some Obama shirts . . so i can really run a muck up here . .	1
417	After all of the sick things TOPIC_Akin said about rape , he still might win , since TOPIC_GOP is now desparate to win the Senate , & amp are supporting him .	1
418	AUTHOR_TOKEN The world keeps handing Romney nails and he just keeps hammering , the lid is already in place .	1
419	TOPIC_failingagenda taking away people 's rights one at a time , right to marry , right to choose . Who has the TOPIC_failingagenda now TOPIC_GOP	1
420	Clint Eastwood ' When Somebody Does Not Do the Job , We Gotta Let ' Em Go ' Soo who els can ? Mitt Romney ? C'mon .	1
421	TOPIC_RomneyRyan2012 Democrats are aliens from some ware unbenost to the cominsence thinking person . Did he say he was going to tell the truth	1
422	So excited to hear the AUTHOR_TOKEN speech tomorrow . Economy is the main issue of this election and he is the best man to talk about it . TOPIC_GOP	1
423	The Cowboys play like they are a bunch of TOPIC_Republicans ! ! ! lmao	1
424	why is a 19 year old teen pop boyband member obsessed with me	1
425	If TOPIC_MittRomney wins this TOPIC_election . . im moving back to Ghana and revoking my American Citizenship . . TOPIC_Obama has been a great president	1
426	Note one person has told me why they are voting for obama hahahhahahahha	1
427	DONT VOTE MITT ROMFAG . . HES GOING TO FUCK THE NATION UP TOPIC_DNC TOPIC_DEMOCRATS VOTE TOPIC_OBAMABIDEN TOPIC_BLUES TOPIC_VOTE	1
428	Watched GOP conventions . Obama has done a fine job . But I just want to see how many times could Romney change his mind during presidency	1
429	AUTHOR_TOKEN just goes to show that u can not listen to 99 % of what rappers say . . how u voting for Romney when uve never registered to vote ?	1
430	AUTHOR_TOKEN But I thought we all lived in racial harmony ' cause negro-supreme Barack was in charge ? !	1
431	AUTHOR_TOKEN AUTHOR_TOKEN AUTHOR_TOKEN AUTHOR_TOKEN better than if he does a ' Libya ' like Obama dropped the ball let another 9/11 attack	1
432	Ran Outta Toilet Paper This Morning , Good Thing I Had Small Stack Of Benjamin 's To Finish The Job TOPIC_Romney	1
433	Romney can not have a chance , can he ? To a swede , he 's pretty surreal . TOPIC_election	1
434	Just a thought , can our next TOPIC_president make shorts and dress sizes for woman cut off at TOPIC_medium , sincerely that TOPIC_asshole	1
435	I look at this election like Poke'mon , you can only catch one legendary , so then you just bitch about the not getting the other , TOPIC_election	1
436	If your a republican you Fail at Life . TOPIC_Democrats 2012 TOPIC_Obama2012 TOPIC_Forward X TOPIC_Change	1
437	Its simple . . you wanna live vote for TOPIC_Obama . . you wanna die . . well you all know the rest . .	1
438	Damn I forgot I registered to vote Sunday ima flip a coin election day to see who ima vote for TOPIC_Romney or TOPIC_Obama head or tails	1
439	Oh but Ivory , Obama blames Islam for 9/11 too ?	1
440	TOPIC_Obama admin uses TOPIC_China ' s news Xinhua to further their own TOPIC_communist propaganda . Birds of a feather hugh ? Nice move comrade O . TOPIC_Socialist	1
441	Bill Clinton does in 4 minutes what Obama could not do in 4 years . Clinton Master . Obama Amateur TOPIC_RomneyRyan2012	1
442	So when politicians lie they get elected ( TOPIC_Clegg ) and when they tell the truth they are destroyed by media who label them losers ( TOPIC_Romney )	1
443	Michael Jackson , King Kong , and Kim Kardashian are worldwide trends ? And these bitches are fretting on Obama ! ? Really ?	1
444	Democrats Obama is a good leader and has inspiring visions for the future . Republicans Yeah , Romney owned a really big company .	1
445	Romney has to at least be putting the white flag on the flagpole by now . . how much worse could it get ? Oh yea , TOPIC_Obama TOPIC_4MoreYears ! ! !	1
446	America voted for change . . gas at $ 3.80 and another downgraded to the credit rating ! ? Let us change back to before TOPIC_obama w / AUTHOR_TOKEN	1
447	If Romney just stopped talking he would have a much better shot at winning this election . TOPIC_idontmind TOPIC_keepgoing	1
448	I will take the Mormon over the moron . TOPIC_RomneyRyan2012	1
449	I think Romney will bring us middle class blatantly down to the gutters but I feel like Obama is secretly up to no good .	1
450	Rr-electing Obama would be like backing the titanic up and hitting the Ice burg again .	1
451	AUTHOR_TOKEN you getting re-elected might be one of the scariest thoughts of my entire life TOPIC_RomneyRyan2012	1
452	Truly Obama 's Jimmy Carter moment attack by Muslims on US embassy & amp US president responds w / weakness & amp stupidity	1
453	Screw TOPIC_VMA ' s and your TOPIC_election crap TOPIC_IDontCare	1
454	I wish I could vote for someone who is not Mitt Romney or Barack Obama . . like Batman or something . write in .	1
455	Selena gets hate , they blame beliebers . Zayn deleted his Twitter , they blame beliebers . Obama farts , they blame beliebers . FUCK YOU .	1
456	There is a difference between being presidential and pretending to be the President , and TOPIC_Romney does not know what it is .	1
457	If TOPIC_Romney becomes president then America has gone crazy . I might be British but come one TOPIC_Obama	1
458	I am going to start saying Henry Merritt Paulson THE THIRD with the same disdain as the Barack HUSSEIN Obama people .	1
459	ROMNEY LIES AND AMERICANS LOSS THE MOST . MIDDLE CLASS WILL PAY HIGHER TAXES AND RICH PAYS NOTHING	1
460	Those who speak it , do not know it Those who know it , do not speak it . TOPIC_Election2012 TOPIC_Fact	1
461	Obama condemns the embassy attack in Libya , but does not even mention the attack in Cairo ? Why do we give them billions ?	1
462	Funny how all the tweeps pissed at TOPIC_Obama for declining a meeting request with Netanyahu are racist Conservatives .	1
463	Canberra Liberals - stealing the Green vote one bin at a time ! TOPIC_election2012	1
464	So lets get this straight , the presidential race is TOPIC_Obama Vs . one guy who 's against a women 's right to choose and the other one 's a TOPIC_Mormon	1
465	TOPIC_republicans and TOPIC_democrats are all in to fucked the world up together	1
466	All votes are counted equal , but some are more equal than others . This makes me proud to be a part of the Animal Farm , I mean TOPIC_USA TOPIC_Election	1
467	If we dont vote for Mit Romney America will be up shit creek without a paddle ! ! Just saying ! ! TOPIC_teamromney TOPIC_saveamerica TOPIC_antioboma	1
468	TOPIC_election2012 Voting this year Gop / Dem is like choosing a bite from a cobra , or a rattle snake .	1
469	AUTHOR_TOKEN AUTHOR_TOKEN . That 's Obama 's Reverend voice . Can I get an Amen ? TOPIC_Mitt2012 and I will be yelling Amen ! TOPIC_Presidentof1000voices	1
470	NO I am Mitt Romney and I am going to do this for America ! NO I am Barack Obama and I am going to do this for America ! SHUT the HELL UP !	1
471	after Michelle Obama 's speech , I think even Romney will vote for Obama . .	1
472	You might think that someone at the RNC For Life event would offer a pregnant lady a seat , but you 'd be wrong . TOPIC_GOP2012	1
473	Found an unopened condom and a TOPIC_Romney flyer in the parking lot . Guess someone could not seal the deal .	1
474	Well , at least at this election , we get to pick our poison . So true . . TOPIC_Election2012 TOPIC_fail	1
475	Using the new TOPIC_GOP TOPIC_RYAN chip timer I just ran a 158 marathon . TOPIC_holysmokes right ?	1
476	If this is just a bump in the road what does that make 911 Obama , a girls track sized hurdle . TOPIC_wtf TOPIC_obama TOPIC_stupid TOPIC_comeon	1
477	Time to read up on my presidential TOPIC_bullshit gota get ready for TOPIC_mrcarlson this weekend TOPIC_democrats TOPIC_obama TOPIC_Horses	1
478	AUTHOR_TOKEN AUTHOR_TOKEN I am surprised he did not accuse Obama of having a weather machine .	1
479	Mitt Romney might as well vote for Obama too . .	1
480	Hey Mitt Romney , You Know That Huge Lead Obama Has ? You Built That . TOPIC_RomneyEncore TOPIC_GOP2012	1
481	AUTHOR_TOKEN I am gonna vote for Mitt just to be ignorant TOPIC_election2012	1
482	People concern themselves w / the smallest things like y does it matter wat Obama and romney tweeted 1st today is it gonna swing the election	1
483	AUTHOR_TOKEN AUTHOR_TOKEN NO ! ! That 's why we Do not date TOPIC_Republicans TOPIC_idiot ! WHY do u think they h8 women so much ? ? TINY DICKS ! ! TOPIC_GOPFail	1
484	A Casual reminder that Mitt Romney physically assaulted a gay man . Santorum was two letters away from calling Obama the n-word .	1
485	You think Barack Obama was the reason for Wisconsin 's economic turn around ? You think his policies benefited WI ? No . TOPIC_RomneyRyan2012	1
486	If you had Panthers game or Concert with 20 % chance of storms would you cancel 24hrs prior ? Looks like Obama could not fill the stadium TOPIC_DNC	1
487	im gunna be such a bitch today . i can already tell feel the TOPIC_president wrath bitches .	1
488	Got enough white to build Barack house	1
489	That 's why I am moving to NY , LA , PARIS TOPIC_4moreyears lol	1
490	. AUTHOR_TOKEN FACT Obama 's policies prevented them from finding gainful employment . TOPIC_obama TOPIC_p2 TOPIC_fail	1
491	If you dont got 50 cent for the toll they charge you 27 dollars for not havin 50 cent TOPIC_Republicans	1
492	Of all the qualified Republicans who are over 35 , Mitt Romney was the best that the TOPIC_GOP could agree on ?	1
493	So 1st TOPIC_Republicans hate the AUTHOR_TOKEN statement , but at the end of the week they are loving it ? TOPIC_Shady TOPIC_Libya	1
494	Obama 's first term is a complete failure . Anyone who votes for proven failure is uniformed , brain-dead or a loser .	1
495	AUTHOR_TOKEN AUTHOR_TOKEN oh he 's moving us forward alright . . into another trillion in debt ! TOPIC_RomneyRyan2012 TOPIC_Scorpiosforromney	1
496	The Anti Christ is about to speak . . all hail Americas Supreme Leader Ayatollah TOPIC_Barack Obama ! ! TOPIC_DNC And yes , GOD Bless America ! ! ! TOPIC_1TermOnly	1
497	TOPIC_Romney getting pummeled like Victor Ortiz ! ! ! Go team TOPIC_Castro	1
498	looked at TOPIC_Romney ' s official website for the hell of it . . scary . People are nut jobs in this world to think twice about him ! ! ! TOPIC_VOTE	1
499	AUTHOR_TOKEN actually . . Obama sounds like a pretty good deal . . Aw no I joke . . Hahah	1
500	I guess this was it , Mitt . Too bad you wasted all that money on campaign spin & amppropaganda , then blew it . Good for 98 % of Americans TOPIC_election2012	1
501	Romney + presidency epic fail	1
502	TOPIC_Obama saying business owners did not build their own companies is like saying AUTHOR_TOKEN did not win all those Gold Medals on his own .	1
503	Spoiler alert you all get cheese calzones in your gift bag at my oval office party ! TOPIC_president	1
504	AUTHOR_TOKEN AUTHOR_TOKEN TOPIC_beckyquick TOPIC_warrenbuffet did warren buffet or Barack Obama give 30 % to charity ? If not , THEY should pay more tax .	1
505	Who are the 47 % that Willard Mitt Romney said he doesn care about ? Many of those who don pay a federal . . URL_TOKEN / / t.co/1GZI1pXo	1
506	AUTHOR_TOKEN Lol i think Obama is the devil . That 's why they put a horrible person to run against him .	1
507	Actually people have no choice other than voting TOPIC_UPFA . My dear TOPIC_Citizen tell me any other Potential candidate ? TOPIC_SriLanka TOPIC_lka TOPIC_Election	1
508	Barack Obama has more respect for illegal aliens and terrorists than he does for American entrepreneurs . ( taken from a tweet by JayDavis )	1
509	AUTHOR_TOKEN born in a circus run by a big bunch of clowns the world is a joke ( TOPIC_election TOPIC_debates TOPIC_mytwocents URL_TOKEN / / t.co/kKp03D9R	1
510	Ima root for Romney this election , because TOPIC_Obama is TOPIC_MAINSTREAM	1
511	AUTHOR_TOKEN AUTHOR_TOKEN yeah because Obama would love to put himself out of a job . .	1
512	There are not enough meds to cure the anxiety of the MessNBC crew after watching our next President hit a home run last night TOPIC_GOP2012	1
513	What TOPIC_romney meant by 47 % was half the country rather cuddle a porcupine then vote for him .	1
514	I 'd there any point in checking Twitter between now and October_3rd ? TOPIC_Election2012	1
515	The new laws Romney & amp Ryan want to . implement & lt Unt uh ! They CAN NOT win .	1
516	C'mon mitt , explain ur error by saying u meant the ' silent , hard-working majority ' , the ' quiet bat people ' if u like . TOPIC_Romney TOPIC_thethickofit	1
517	Even mother nature hates TOPIC_republicans AUTHOR_TOKEN	1
518	Since mitt Romney really did not have any sort of campaign he gonna adapt to this iPhone realise like I have one relate to me	1
519	Romney can not win because he 's a mormon . Obama can not win because he has a really dark tan . You know what this means ? KATONA FOR TOPIC_PRESIDENT .	1
520	Mitt Romney AND Barack Obama full of shit . I do not know why everybody insist on taking sides & lt	1
521	If U R a teacher , a woman , part of the LGBT movement , rely on TOPIC_HealthCare / TOPIC_SS / Gov't Pensions , etc you 'd be a fool to support TOPIC_Romney .	1
522	TOPIC_Obama says will not break the bonds between the United States and TOPIC_Libya As if Americans are gonna leave after so much hard work	1
523	Mitt Romney has been caught in so many lies publicly its ridiculous . . and Paul Ryan is just an imbecile . . TOPIC_MyOpinion	1
524	Does anyone find it ironic Barack TOPIC_VoteOneDirection over justin even though justin lives in the US ? No ? Just me ? ok . TOPIC_VOTEONEDIRECTION	1
525	AUTHOR_TOKEN where 's the debt reduction ? Spending cuts ? TOPIC_RomneyRyan2012	1
526	TOPIC_obama2012 TOPIC_romneyryan2012 Obama - combination of money & amp politics that offers endless opportunities for greed & amp tragic ABUSE OF THE POOR	1
527	Arrey O Sangma , ye stunts kyu ? Do not you know , no one cares about the President ? TOPIC_president	1
528	AUTHOR_TOKEN seems like your very good at lying or pleasing whatever setting or crowed your addressing what a great TOPIC_president	1
529	I had no clue so many people I knew were such political experts . . TOPIC_election2012 is it November yet ?	1
530	Nicki Minaj is a dumb bitch buh she voting for Romney TOPIC_GTFOH	1
531	TOPIC_GOP2012 Hang on do not Hurricanes need a lot of hot air to keep going , ahh that 's why they cancelled day_1 !	1
532	Hopefully speech fact checkers hold TOPIC_democrats just as accountable as they did the AUTHOR_TOKEN last night . TOPIC_countryoverparty	0
533	RT AUTHOR_TOKEN All that needs to be said . . TOPIC_RomneyRyan2012	0
534	RT AUTHOR_TOKEN I am thinking Romney must have some good internal polls . He looks relaxed , confident & amp , as I said before , TOPIC_president . .	0
535	AUTHOR_TOKEN congrats to mr Hassan sheikh mohamud , our newly elected TOPIC_President of TOPIC_Somalia .	0
536	Because of TOPIC_marriageequality , my same-sex friends have a TOPIC_realmarriage too , AUTHOR_TOKEN TOPIC_GOP 2012 AUTHOR_TOKEN	0
537	AUTHOR_TOKEN Barack Follow mee ! ! pleasee ! ! I will vote for you ! ! You are the best ! !	0
538	everyone vote Abigail Nunez for freshman class president ! she passed out tamales as campaign food lmaoo TOPIC_Vote TOPIC_Freshman TOPIC_President TOPIC_C . O2016	0
539	FFA meeting tonight at 730 come and see me run this shit TOPIC_president	0
540	I have said it before , and I will say it again . . MY body , MY choice TOPIC_PaulRyan TOPIC_MittRomney TOPIC_RNC TOPIC_Republicans . Until men can bear children , STFU !	0
541	AUTHOR_TOKEN Romney is a pawn that does what he 's told . The government is way bigger than the president so it does not matter who wins sadly	0
542	Stupid bitch ! RT AUTHOR_TOKEN Mitt Romney basically said all black people lazy & amp has no work ethic . . Ol'e cracker ass	0
543	AUTHOR_TOKEN never knew Obama 's plan either or should I say still do not . TOPIC_allpoliticianstalkthesame TOPIC_election2012	0
544	Because they have no ideas or issues , a typical TOPIC_GOP ad hominem attack URL_TOKEN \ / \ / t . co \ / Ie2oyM1Q via AUTHOR_TOKEN	0
545	i heard they was blowing down on Nicki Minaj on the radio this morning for saying vote for Romney . People then said way worst shit . GOHD !	0
546	AUTHOR_TOKEN he 's gonna use your number to see where you live then come and eat you TOPIC_obama	0
547	TOPIC_istandupfor TOPIC_Obama because he saved the auto industry ( car lover ) and he isnt trying to make college a rich people club ( student )	0
548	AUTHOR_TOKEN sick tweet barack brobama	0
549	RT AUTHOR_TOKEN RT AUTHOR_TOKEN In wake of Libya attack , TOPIC_Obama says TOPIC_Romney a tendency to shoot first and aim later TOPIC_Election2012ALLEZ !	0
550	Wee so happy for my boy Alex Burrows TOPIC_4MoreYears TOPIC_FrenchiesAreMyFave AUTHOR_TOKEN	0
551	RT AUTHOR_TOKEN Absolutely can not wait to vote . TOPIC_RomneyRyan2012	0
552	RT AUTHOR_TOKEN I will donate $ 5 to TOPIC_Mitt2012 for every retweet this gets in the next 5 mins . Go ! TOPIC_tcot	0
553	Just like Mitt . RT AUTHOR_TOKEN Obama joins his campaign in continuing to mislead Americans about the accusations from his Super PAC ad .	0
554	AUTHOR_TOKEN now we need new TOPIC_appliances and TOPIC_romney sent manfctng jobs overseas TOPIC_buyAmerican ? Labor does matter so do the words MADE IN AMERICA	0
555	AUTHOR_TOKEN AUTHOR_TOKEN Romney was wrong to inject partisan criticism without all the facts . No WHouse would ever talk with Amb missing	0
556	Paul Ryan is a fraud . TOPIC_romney TOPIC_obama TOPIC_election URL_TOKEN \ / \ / t . co \ / dyQpzhi 9	0
557	RT AUTHOR_TOKEN RT AUTHOR_TOKEN Hilarious Saw a pretty awesome sign while door knocking today . TOPIC_Obama TOPIC_RomneyRyan2012 TOPIC_Mitt2012 TOPIC_RomneyIA URL_TOKEN . .	0
558	Nicki Minaj Fucked Up With That Mitt Romney Line , True Or Not .	0
559	Feel like throwing a TOPIC_DNC party tonight to watch Obama 's speech . Will save that for when he wins ! TOPIC_4moreyears	0
560	The fact nicki manaj isnt on that TOPIC_Obama train . Makes me feel like her and I can be best friends .	0
561	Cant wait to hear Obama 's official acceptance speech tonight . Can it beat Clinton 's & amp Michelle Obama 's amazing speeches ? ! TOPIC_DNC TOPIC_4moreyears	0
562	New TOPIC_RomneyRyan2012 bumper sticker sighting in CoMo ! I seriously get excited everytime .	0
563	TOPIC_Romney fires over & amp over against TOPIC_Obama via twitter . Tweets sound naive like a kid . Obamas team is using it smart . TOPIC_LetTheBigBoysPlay	0
564	Romney would 've beaten Joshua at TicTacToe TOPIC_Romneystrength TOPIC_WarGames	0
565	Do not worry you all we will get to roll toomers when Obama get re-elected ! ! ! TOPIC_4MoreYears	0
566	AUTHOR_TOKEN AUTHOR_TOKEN AUTHOR_TOKEN AUTHOR_TOKEN AUTHOR_TOKEN AUTHOR_TOKEN Yes true ! Total fool about women ! TOPIC_Elitism TOPIC_Romney	0
567	Ready to give up TOPIC_hope and TOPIC_change the countrys path ! Sick of hearing about TOPIC_polls , 3 months out ! No more TOPIC_election news please !	0
568	TOPIC_Obama is the best ! ! ! Vote for him folks ! ! - )	0
569	AUTHOR_TOKEN Hi , the bus info on the TOPIC_obama visit is wrong ( TOPIC_5 does not go to mem union ) . Tks .	0
570	Much is wrong with this Gov . Obama it at it 's center . We must , WE MUST ! ! get off our duffs and call our Congressmen Senators & amp White House	0
571	The tostitos commercial with the fake barack and romney had me rolling	0
572	Some things will just never make sense to me . TOPIC_Election2012	0
573	Buhahahahaha RT AUTHOR_TOKEN I have no doubt that Michelle would have done a better job than Barack himself , if she were president .	0
574	Coming up this morning at 8 and 9 - TOPIC_President TOPIC_Obama ' s UN speech and TOPIC_Joe TOPIC_Senser speaks out after wife is convicted of deadly hit and run .	0
575	Barack and Michelle are the cutest First Couple , yo . The others scare me with their robotic expressions .	0
576	I so can not stand Dan Rather , AUTHOR_TOKEN never talks down to me at all . All you old men have to get in your dig at the TOPIC_President ! TOPIC_Maddow	0
577	What if Romney becomes president . I 'd probably run for it . TOPIC_election	0
578	Most people voting for Obama have no clue what they are voting for TOPIC_RomneyRyan2012	0
579	RT AUTHOR_TOKEN Presidential Election Obama 47 % ( + 1 ) , Romney 46 % ( - 1 ) . Get the full trend . . \ nhttp \ / \ / t . co \ / W9iTQMk5 TOPIC_Election2012	0
580	Excited for this upcoming TOPIC_election and being informed	0
581	Mitt Romney wants to ban porn . . fuck that nigga .	0
582	Come Election Day , there will be those who vote for TOPIC_obama and there is those who will vote wrong . Do not vote wrong . Vote for TOPIC_obama	0
583	Romney , Leadership , and the 2002 Olympics - National Review Online ( blog )	0
584	Fort Worth Christian LOVES Dubya AUTHOR_TOKEN AUTHOR_TOKEN TOPIC_GOP	0
585	AUTHOR_TOKEN keep it up Mr . Trump ! ! I live your takes and think USA needs more realism ! ! TOPIC_romney	0
586	These TOPIC_democrats at the convention JAMMIN ' and actually on beat TOPIC_proud lol	0
587	Debate for Mr Brunicardi 's class today TOPIC_democrat TOPIC_election TOPIC_obama	0
588	That awkward moment you realize Mitt Romney Slogan , America American was the same slogan used by the KK in 1922	0
589	TOPIC_majoritarian TOPIC_election results available and we will update every thirty minutes URL_TOKEN \ / \ / t . co \ / M9Nfy4wO TOPIC_gvote	0
590	Some people are so narrow-minded that they have to stack their prejudices vertically ! Can you spell TOPIC_GOP , TOPIC_Fox TOPIC_RWNJ , TOPIC_NRA ? ? ? TOPIC_p2 TOPIC_CTL	0
591	I love TOPIC_ElizabethWarren ! Hope she wins Massachusetts ! ! ! TOPIC_election2012	0
592	President Clinton was brilliant and one of the greatest speaker of our century TOPIC_Clinton TOPIC_DNC2012 TOPIC_Obama2012 TOPIC_4moreyears	0
593	really fantastic video - Mitt Romney and a gay Vietnam vet talk over New Hampshire 's gay marriage policy TOPIC_gayrights TOPIC_election2012	0
594	CNN is on an Anti-Obama tip , all of a sudden they are Romney 's biggest groupie . . all news are on Romneys campaign and how Obama failed .	0
595	Mitt Romeny is Delusional ! 200k ? middle class ? Seriously ! ? TOPIC_VoteObama TOPIC_4moreyears	0
596	So I had a dream that Obama came to visit my husband in our beautiful house . That was such a good visual of what life could be .	0
597	I stand by Obama 100 % he deserves another 4yrs in office . TOPIC_BARACK	0
598	HOMELAND ! TOPIC_EmmyCongrats PROUD OF THIS SHOW ! Barack will be happy , right ? )	0
599	we asked this old rich white couple for help with the car & amp the man sed ill only hekp u if u vote for TOPIC_obama	0
600	Love being away during election time . I get to see how we act from another country 's perspective . We look like a racist mess . TOPIC_election2012	0
601	My 3 top dreams Meet and shake hands with Barack Obama , Hold hands with that special someone , and become a U . S Army Ranger )	0
602	Watching AUTHOR_TOKEN ' s DNC speech at a McDonald 's in Ibiza ( free wifi ) . Absolutely moved me to tears . TOPIC_4moreyears TOPIC_my TOPIC_first TOPIC_lady	0
603	Mitt Romney is arrogant as hell . He has racism written all over his face .	0
604	At this point I think TOPIC_MittRomney should just drop out of the race . . the human one . TOPIC_election2012	0
605	There is more clapping than the actual speech . . TOPIC_GOP2012 TOPIC_RNC	0
606	Seriously though , anyone who has to take office after 8 years of total fucking up , deserves just as long to try & amp fix it . TOPIC_ObamaBiden2012	0
607	When is he speaking I am sleepy ? TOPIC_GOP2012	0
608	im just waiting for the colonel to come out and release his knew chicken recipe . Is it me or is this the most taccy convention ever ? TOPIC_GOP	0
609	TO PRESIDENT Obama i just wanted tell u that i believe in your plan and policy . im voting for u in november_100 %	0
610	AUTHOR_TOKEN I thought I 'd never see the day AUTHOR_TOKEN joined twitter ! The Hashtags will be flying now TOPIC_socialists TOPIC_democrats TOPIC_diseltruck	0
611	Burns Rand would hate Romney / Ryan like she hated Ronald Reagan . TOPIC_tlot you hear that TOPIC_tcot ?	0
612	AUTHOR_TOKEN really was , Ann Romney should have been taking notes	0
613	Psyched MT TOPIC_Debate will contain six segments 1-3 Economy 4 Healthcare 5-6 Government , Governing TOPIC_Obama TOPIC_Romney TOPIC_POTUS	0
614	AUTHOR_TOKEN good luck Ruben . You deserve being there , enjoy it and learn a lot ! ! C'mon Barack ! !	0
615	AUTHOR_TOKEN Yes , Reagan had a quiet strength about him . I see the same quiet strength in Romney ! I see the strength and resolve in Ryan .	0
616	I had a weird dream last night were I was being interviewed by Romney for a job . I said I was going out for a cigarette and never went back .	0
617	Lmaoo , see Barack you would have my vote but the way my birth certificate is set up . . . * Stolen from Gevaun *	0
618	If you are not already , get registered to vote ! Exercise your right to ! TOPIC_4moreyears	0
619	I love Joint Leadership Conferences . TOPIC_FBLA TOPIC_PRESIDENT	0
620	AUTHOR_TOKEN thanks Lisa and congratulations to newly elected Morinville Councillor Sheldon Fingler TOPIC_morinville TOPIC_councillor TOPIC_election	0
621	I am SOO ready for tomorrow 's debate TOPIC_tcot TOPIC_Romney	0
622	Ann Romney nailed it ! ! An American mom speaking from the heart ! TOPIC_Love TOPIC_GODBlessAmerica TOPIC_2012GOP	0
623	I am interested by the religion -- US 2012 TOPIC_election tweets . . I think that angle of election coverage hardly exists at all in UK and Europe .	0
624	AUTHOR_TOKEN AUTHOR_TOKEN And I see that my tax dollars are going to help people who should be helping themselves . TOPIC_ROMNEY	0
625	I shook Mitt Romney 's hand ! ! ! I am so excited ! ! !	0
626	TOPIC_Romney gave 30 % of his income ( $ 4mil ) to charity in 2011 . Your argument that he is greedy and does not pay his fair share is invalid .	0
627	Ive been registered to vote for a year . Time to put that shit to use TOPIC_Obama	0
628	Twitter rage . Fuck you and your boner . TOPIC_Obama	0
