id	preprotext	irony
20f4d344c4f2c2479a70efd5f29bded4	Ridiculo absoluto , el abogado de VOX llamado a el orden por el presidente de la sala y no ha hecho más que empezar el primer testigo Joan Tarda , solo buscan venganza humillación escarnio , que gentuza . Lograrán sacar a la gente a la calle .	0
0ded376661e0bef882204958159e3e56	Se puede decir más alto pero no más claro , chapeau Tardà , we love you ! [ VÍDEO ] Declaració íntegra de Joan Tardà a el Suprem - VilaWeb URL_TOKEN	0
4da3b33a38e3a959f02d7507455ef537	Se reanuda el juicio de el « procés » : Joan Tardà , antes de declarar en el Supremo , asegura que entra « en la casa de los horrores » URL_TOKEN URL_TOKEN	0
259714688e962ad2c60afb429711548a	"Se retoma el Juicio de el Proces "" Joan TOPIC_Tardà ( portavoz de ERC en el Congreso )"	0
464d69dc066c657ada9ac10f3e398400	Siento tener que decir lo pero acostumbro a decir la verdad . El interrogatorio de AUTHOR_TOKEN a Joan Tarda me ha parecido muy flojo , por no decir otro adjetivo más duro . Espero que esto cambie y que nos lo explique AUTHOR_TOKEN	0
996d2c41ee8f624300865000101300dd	"Soraya Sáenz de santamaría en una de las mejores viñetas que he tenido el placer de disfrutar Visto el percal que dirige el PP en estos momentos , y recurriendo a el refranero otros vendrán que bueno te harán """	0
5aa649406518c7bd497c2a87adc66d23	Supongo que alguien lo habrá dicho si no lo digo yo . Joan Tardà es gilipollas .	0
a55b68b6ed52a4b3faf53f632e99e009	Tardá arremete contra Rivera llamando le de nuevo “ fascista ” AUTHOR_TOKEN URL_TOKEN	0
492cb2932c4c65ff596ccdf2fb84af98	"Tardá vuelve a enzarzar se con Rivera : ¡ Fascista ! "" URL_TOKEN """	0
d7de815474d597dad0928c94964b1933	Tardà , el Señor Joan Tardà , es un imprescindible de la política , cada vez que sube a el estrado deja a los vende motos de el PP + Cs a la altura de el betún y da un repaso ideológico muy necesario	0
7e0de54722a0d24327a179f7c24f96ae	Tardà : “ ¿ tengo derecho a responder en catalán ? ” Juez Marchena : “ No ” . URL_TOKEN	0
90c1152e111f15f3b1518056d40ea095	Tardà : “ ¿ tengo derecho a responder en catalán ? ” , a lo que el magistrado respondió a las claras : “ No ” . URL_TOKEN	0
85b9eaf8242bd7705cd2ba00128b3cb8	Te cita Vox como testigo ( Joan Tardá ) y te pregunta : - ¿ Recuerda un tweet de 2016 en que hablaba de autodeterminación ? - ¿ Se reunió alguna vez con compañeros de partido ? - ¿ Recuerda alguna reunión concreta con compañeros de partido ? - No hay más preguntas . Ridículo nivel Vox .	0
2a3eeddd453961a4e4de3fc1a3d9bcf8	"Te contamos todo sobre la declaración de Joan Tardà : Fue voluntad de el pueblo indefenso después de que le negaran un referéndum pactado "" URL_TOKEN """	0
19140dadff8a3f560dfe357c196072a8	"Te guste o no Joan Tardà , seas de ERC o no , las cosas como sean : hoy Tardà ha sido bastante y mucho puto amo "" EMOJI_769"	0
df06a8d79e6dfc777ae9f59a21f20c99	Tensión entre Joan Tardá y la abogacía de el estado por AUTHOR_TOKEN - URL_TOKEN vía AUTHOR_TOKEN	0
cdca740a339aee56c3beedf156a4908a	Tienen a el incendiario Joan Tarda y la abogacia y la físcalia no aprovecha está oportunidad . DIOS TOPIC_juicioprocés	0
44f6669d483ff1be132020156ab121b2	"Todavía estamos a tiempo con Cataluña "" Joan Tardá"	0
0884e388c3d1a3d2c94987a3f4e1316f	"Tu eres un golpista y nada más Tardá . Juicio procés : Joan Tardà llama a el Supremo casa de los horrores "" y a los golpistas "" defensores de la democracia "" URL_TOKEN """	0
46a5728279139199a46481c3011cf37e	"Va a perder mucho el congreso sin este diputado como voy a echar de menos sus discursos . . Joan Tardà : No creo que me toque presentar me ( el 28_de_abril ) hay mucha gente joven y preparada "" | LA SEXTA TV - NOTICIAS URL_TOKEN"	0
5b3e510b6cbcab395dcb1db5bdd06c79	Vamos a ver , ¿ se han enterado tanto la acusación popular como lo que llevamos de la defensa de que el enjuiciado no es Joan Tardà ? ¿ Qué tiene que ver lo que le están preguntando con los encausados ?	0
7c47abbb3c626e2de01d41a8839eceee	"Ver JUICIO CONTRA EL GOLPE DE ESTADO ( JOAN TARDÁ ) DIRECTO "" en YouTube URL_TOKEN """	0
671ba9e5265198b7e461091b046dded6	Vergüenza ajena escuchar a Joan Tardà en el Congreso , más irónico si cabe , con imágenes de el juicio de fondo .	0
64d68a2edb3e63519de8f76b05c0d7eb	"VÍDEO URGENT Joan Tardà desafia el Supremo : Voy a contestar en catalán a Vox "" URL_TOKEN """	0
933c4a4cb5a88398d545df97dedee70c	Y ahora a las defensas , que son quienes preguntan ahora a Joan Tardà : « No ha sido llamado el señor Tardà para que explique los métodos de Esquerra para luchar por su ideario político » .	0
2ab69209abce3afd73a36c085b6cb49f	Y la abogacía de el Estado vuelve a dejar claro el poco respeto que tiene por una de las lenguas de el Estado Español . . Gracias Joan Tardà por hacer que se retrate	0
0900f76026c0b93d0188907eaaf86cfd	Yo no sé vosotros , pero adoro a Joan Tardà : Yo hablaré en catalá a VOX TOPIC_judiciproces	0
82fd68f05d7e1004af87674d07b2aba1	⏰ 10h . Comienzan las declaraciones de los testigos en el juicio de procés . Hoy lo hacen , entre otros : 10h . Joan Tardà 10:30 h . Roger Torrent 11h . Artur Mas 11:30 h . Soraya Sáenz de Santamaría 12h . Cristóbal Montoro 16h . Mariano Rajoy 16:30 h . Marta Pascal URL_TOKEN	0
7aba2f9b5d2c5016a7278c4f009dd40b	▶ ️ VÍDEO | Joan Tardà comenzó su declaración en el TOPIC_JuicioProcés con un rifirrafe con el juez Manuel Marchena por el uso de el catalán URL_TOKEN URL_TOKEN	0
bff55bfc60c8baaf7861f17a6f7abab5	▶ VÍDEO | Segueix en directe la declaració de Joan Tardà URL_TOKEN	0
298e18094e84fbea283a1505aa755c22	"► Cuixart ensalza el procés como desobediencia civil no violenta ► Forcadell rechaza que la DUI tuviera consecuencias jurídicas ► Joan Tardà : Este juicio está inspirado en la venganza """	0
e3434152d541c9b3e8f7de14f080410e	⚖ ️ JUICIO DE EL PROCÉS ⚖ ️ Joan Tardà ha negado en su declaración la violencia de el 1 - O : “ Fue voluntad de el pueblo indefenso después de que le negaran un referéndum pactado ” URL_TOKEN	0
a3644e7b93601deb8ff3fd03fe6ab45b	⚖ ️ Mañana es el turno de los testigos en el TOPIC_JuicioProcés 📌 Encabezados por el expresidente de el Gobierno Mariano Rajoy y cuatro miembros de su gabinete que cesaron a el Govern de Puigdemont . 📌 Roger Torrent , Artur Mas , Joan Tardá y más tendrán 30 minutos para dar su testimonio . URL_TOKEN	0
4aabf69c32f8d3f9f5f9d3b388edd297	"⭕ TOPIC_Directo | Marchena amonesta a Joan Tardà y le pide que no haga valoraciones políticas "" URL_TOKEN TOPIC_JuicioalProcés """	0
522a2caa3619169801a3375625124bbd	"⭕ TOPIC_Directo . Sigue con nosotros el TOPIC_JuicioalProcés | Joan Tardá arranca con un enganchón con Marchena : Este juicio está inspirando en la venganza "" URL_TOKEN """	0
27032c88b482b9fd108cac033d34dc95	📺 DIRECTO | En marcha la nueva sesión de el juicio de el procés , hoy con los testigos . Joan Tardá , el primero en intervenir Sigue lo aquí URL_TOKEN URL_TOKEN	0
8f6ce994661ec71ebc730079b2d8cb7f	"📺 Declaració de el diputat AUTHOR_TOKEN a el TOPIC_judiciprocés 🔊 ¿ Puedo hablar en catalán ? """	0
1b060ad917a96697b0507c8256b577e5	"📺 Declaració de el diputat AUTHOR_TOKEN a el TOPIC_judiciprocés 🔊 ¿ Puedo hablar en catalán ? """	0
075b86e9bc66abe4f5b0d739035b4fe4	🔴 TOPIC_EnDirecto Joan Tardà quiere responder a AUTHOR_TOKEN en catalán y Marchena le para los pies TOPIC_JuicioProces URL_TOKEN	0
9949d039a31cc2f28fe81703d43210dc	"🔴 TOPIC_EnDirecto Joan Tardà rechaza haber se sentido violentado "" en la concentración ante la consejería de Economía TOPIC_JuicioProces URL_TOKEN """	0
2bff365ac0d5f4d23a17c1148d036388	🔴 📽 ️ DIRECTO | El presidente de el tribunal abronca a Joan Tardá por responder en catalán TOPIC_JuicioProcés URL_TOKEN	0
6babadcb0936dc395e14404706c3b8b2	🔴 Además de Rajoy , Santamaría y Montoro , también declararán Joan Tardá y Artur Mas . TOPIC_ProcesoProcésARV ➡ URL_TOKEN URL_TOKEN	0
4611ae3c410b45bf19a2dd70f0881346	🔴 DIRECTO TOPIC_JuicioProces Joan Tardà responderá a Vox en catalán URL_TOKEN	0
3c7bd3a35d4e684878a6762be5a457fd	🔴 DIRECTO | Comienza la declaración de Joan Tardá en el Tribunal Supremo TOPIC_JuicioProcés URL_TOKEN	0
3a0487136a1ff354c2cbc41ee65778ed	"🔴 DIRECTO | El diputado de ERC Joan Tardà , el primero que declarará hoy en el TOPIC_juicio de el TOPIC_procés , asegura estar fresco como una rosa "" ante la declaración de hoy en el Supremo URL_TOKEN """	0
b90aab4836accd76ded7482f1c91e2af	🔴 EN DIRECTO Se reanuda el juicio contra el independentismo catalán . Joan Tarda es el primer testigo en declarar URL_TOKEN URL_TOKEN	0
26debdd5de8766af15ff711e4a422336	"🔴 En vivo | TOPIC_JuicioProcés Joan Tardà niega que la movilización fuera una forma de coaccionar a el Estado "" sino una forma de "" reivindicar para avanzar "" en las ideas sociales """	0
4e5c4dc23f606f9b46eed1a93314bc70	🔴 En vivo | TOPIC_JuicioProcés Joan Tardà , que exhibe lazo amarillo , admite que conoce a el ex número dos de Oriol Junqueras ( Josep María Jové ) pero ignora el documento señalado como hoja de ruta de el independentismo	0
5042efd80f01bb3792bcb93aa5fb1073	🔴 En vivo | TOPIC_JuicioProcés Concluye la declaración de Joan Tardà y comienza la de Artur Mas URL_TOKEN	0
0cd2799047b18fa2fca5df74809f373c	"🔴 En vivo | TOPIC_JuicioProcés Joan Tardà dice que el 1 - O fue uno de los momentos más emotivos "" de su vida y que se acordó aquella jornada de su "" familia republicana "" URL_TOKEN URL_TOKEN """	0
9d161ff6c24d938c330df36007ccd694	🔴 Sigue EN DIRECTO la octava jornada de el juicio de el procés : Declara como testigo el diputado de ERC Joan Tardá , URL_TOKEN URL_TOKEN	0
2018668bb093b4d522a6b879378746f1	🔴 Sigue Soraya Sáenz de Santamaría y todavía quedan por testificar hoy : Cristóbal Montoro , Mariano Rajoy , Marta Pascal , Nùria de Gispert , Eulàlia Reguant y Antonio Baños , según el calendario previsto . Hasta ahora solo han testificado Joan Tardà y Artur Mas TOPIC_JudiciProcés	0
f3dbbe443ce65254583e452561a49025	🔴 Termina la declaración de Joan Tardà . TOPIC_ProcesoProcésARV ➡ URL_TOKEN URL_TOKEN	0
7d27c9e2ff867ac50e14c4fa4821685d	🔴 ÚLTIMA HORA : Mariano Rajoy , Joan Tardá , Roger Torrent , y Artur Mas citados a declarar el Martes_26_de_Febrero en el juicio de el Procés . El Miércoles lo harán Soraya Sáenz de Santamaria , Juan Ignacio Zoido y Cristóbal Montoro .	0
b89b56ce81d208b6f73bac006c8140e1	🔶 JUICIO DE EL ‘ PROCÉS ’ : Joan Tardà dice que contestará en catalán a la acusación popular que ejerce AUTHOR_TOKEN y Marchena le recuerda su obligación de responder en castellano .	0
2f9bf8618eb861bbf99cbcd2cfece3db	"🗣 Joan Tardà : Ni la unidad de España ni la independencia de Catalunya vale violencia "" URL_TOKEN """	0
cb0de7071901c0fadd22fa882d11d779	17 cosas que no sabías de Joan Tardá URL_TOKEN	0
29254b69ab680267db40a8a2cb34112a	27-2-19.TX.TVE.PAG . 106 . ` ` CASA HORRORES ´ ´ . EL JUICIO DE EL ` ` PROCES ´ ´ , INDEPENDENTISTA , CONTINUA CON LA FASE TESTIFICAL DE EL JUICIO . EL PRIMERO DE LOS TESTIGOS , EL DIPUTADO NACIONAL DE ` ` ERC ´ ´ , SR. JOAN TARDA . DIJO , ANTES DE ENTRAR EN EL ` ` TS ´ ´ . QUE IBA A ACCEDER A ` ` LA CASA DE LOS HORRORES ´ ´ . OK .	0
43c5ea1ac75579a9e5537e9343a63287	A Joan Tardà le cuesta entender que debe declarar por obligación en español y como testigo estar a disposición de el Tribunal . Este es el nivel y el tiempo que nos hace perder esta gente . TOPIC_JuicioGolpistas TOPIC_elecciones2019votoderechas 🇪 🇸 URL_TOKEN	0
ecc75fb0488e8af76f960a48cca81f8a	"A ver si Joan Tardá aclara si el 1 - O y la proclamación de la República tuvo algún valor legal , o no tuvo ninguno y fue una tomadura de pelo a los independentistas q llevaban años oyendo lo de en 18 meses independencia "" . """	0
1aa8776e3057d3a79e15a1f51e58e705	Acaba la declaració de Joan Tardà URL_TOKEN	0
b94da96a612d2baec6f3ee762bdb7cb5	Acerca de el referéndum de el 1_de_octubre_de_2017 , Joan Tardà considera que fue “ la voluntad de un pueblo indefenso , cívico y democrático ” URL_TOKEN	0
94ed04705b3506bc2a50efb85fda6fc9	Ahora fiscalía sí que pregunta a Artur Mas . No lo ha hecho con Joan Tardà .	0
2e09e64ac0f171e776416dbadd12edc1	A el principio de la declaración , Joan Tardá expresa el deseo de hablar en catalán y no se le permite . Tampoco se permiten valoraciones . De la media hora que se supone que durará la declaración , se está perdiendo mucho tiempo en las rectificaciones . TOPIC_JuicioalProcés URL_TOKEN	0
5f30db3a5cc9831ff87ac504648c750a	Andreu Van den Eynde pregunta a Joan Tardà URL_TOKEN	0
b49893defa7c43b60e72d4e52ef0c2ae	Aquí podéis seguir en directo en streaming el juicio de el ' procés ' . Comienza Joan Tardà URL_TOKEN	0
08879e5f78dfe5ea9decf22af85acedd	Artur Más no es sectario , es de los listillos que generaron la secta para beneficio personal . Joan Tardá o Tardà , o como coño se escriba , sin embargo , sí parece de los fanáticos que se acabaron creyendo su propia fantasía URL_TOKEN	0
8505903977aa7e7786df38ae643177ac	Arturo Mas DECLARANDO EN DIRECTO . . JUICIO CONTRA EL GOLPE DE ESTADO ( JOAN TARDÁ ) DIRECTO URL_TOKEN vía AUTHOR_TOKEN	0
378c1e08791869649293d4cc722e14f8	Cataluña : Joan Tardá en el juicio de el procés , en directo - URL_TOKEN	0
7526b7b85a2865e1f396577527c87a84	Comienza a declarar Joan Tardá como testigo en el juicio contestando a el abogado de Vox . Un día en el cual tendremos como testigo Rajoy , Sáez de Santanaría , Mas , Montoro URL_TOKEN	0
f0719555bedad5e90da8d14c3e4d177f	Comienza el turno de los testigos en el juicio de el procés . Los primeros en declarar , políticos como Mariano Rajoy , Soraya Sáenz de Santamaría , Joan Tardá y Artur Mas . ▶ ️ URL_TOKEN URL_TOKEN	0
b0dbacaff9bd88fc8cce3743dccba853	"Comienza la declaración como testigo de Joan Tardá . En su primera intervención ha señalado que este es un juicio inspirado en la venganza de un Estado que se sintió humillado "" URL_TOKEN"	0
d1d8192c25a539a93f2180f5308b4032	"Comienzan a declarar los testigos en el TOPIC_juicioprocés . El secretario general de Vox , Javier Ortega , pregunta a el diputado de ERC Joan Tardá . Habla en catalán y Marchena le replica : No empezamos bien "" URL_TOKEN """	0
67632a6b7d51a30b492aa47058e1b5c2	"Con esa cara de no mirar te a el espejo hace siglos , AUTHOR_TOKEN llama a el Supremo casa de los horrores "" y a los golpistas "" defensores de la democracia "" URL_TOKEN """	0
e876d20db4e68af2d14d7d385168b4aa	DIRECTO | Primera pregunta de la acusación particular , ejercida por VOX , a el diputado de ERC , Joan Tardá : URL_TOKEN URL_TOKEN	0
094b00cdba7a6ce50c82dc8996de22cf	El TOPIC_TS cita a los primeros testigos en la causa especial 20907/2017 para los días 26 , 27 y 28 . El primero en comparecer será el diputado de ERC Joan Tardà URL_TOKEN	0
19eff6ba16b62d8219362eb68c9cc1e3	El diputado define que ERC es un “ partido republicano , accidentalmente independentista y antifascista ” URL_TOKEN	0
0ddfe505b532e950952095fbec9e976c	El Frente de Madrid , acompañando a Joan Tardà a declarar a el TS , de los pocos políticos transparentes de hoy día , que dice lo que piensa y hace lo que dice ! ! ! Grande Joan EMOJI_735 EMOJI_55 URL_TOKEN	0
f6bffed02fee9629e11678de3b9bd4b1	El golpismo catalán en el banquillo . Joan tarda ya empieza a liar la en el juicio . No escucha a el Presidente de el Supremo , quiere hablar en catalán y dar un discurso político . Esta como testigo .	0
6aa289a9d6daca0828e832897f9923d0	"El indecente Joan Tardà tilda a el Tribunal Supremo de la casa de los horrores """	0
bc023308739b158bbbf20226e47a3749	El juez Marchena corta en seco el intento de mitin político de Joan Tardá en el juicio de el 1 - O - El Diestro URL_TOKEN	0
565bab6dfbc264f2f17f33b552e85b45	El juez Marchena corta en seco el intento de mitin político de Joan Tardá en el juicio de el 1 - O TOPIC_FelizMiércoles URL_TOKEN	0
2233e0c2328da3d14d24d854dbbe2436	El juez Marchena corta en seco el intento de mitin político de Joan Tardá en el juicio de el 1 - O URL_TOKEN vía AUTHOR_TOKEN	0
e283014d1787317c5e32d85f445ec0d8	El Juez Marchena frenando a Joan Tardá y a los de VOX . Enorme	0
f45339d1177a04300586bfa8326a4f32	Alguien vs Relator , la película .	1
1e23311a32fa825338ac735e8db1026b	AUTHOR_TOKEN Ejemplo de diálogo . Él : da me tu cartera . Ella : no quiero , es mía . Él : Paco ven para acá , que vas a hacer de relator , y llegamos a un acuerdo en cómo me da la cartera .	1
38362107fdf8ace43296b5f4643f98cb	"¡ Buenos días ! Palabreja de moda es la palabra relator "" pero . . para tontuitear un buen día . . la sustituiré por cuentista que en la siguiente frase suena mejor :"	1
0e05a5e3573c9f3330667a05eb65e6cb	AUTHOR_TOKEN AUTHOR_TOKEN Robando y robando a todos los españoles . Seguro que ha sido el relator . TOPIC_ThisIsTheRealSpain TOPIC_MarcaEspana URL_TOKEN	1
119a3eb0c2dc573813f9e75263a651cd	Qué queréis que os diga , pero a mi esto de Relator me suena a título de maqueta de un grupo heavy de Vallecas .	1
d075802f075f0b70f6a381abdbf253df	"Se podría decir que Villarejo es un relator "" ? EMOJI_51 🤨 EMOJI_787 EMOJI_777 URL_TOKEN """	1
2a51bcdeee2f30a60adc149e9cd4315b	Ida y vuelta a bc n de nuevo , me postulo como relator lo confieso URL_TOKEN	1
a7c3da2686f19de185a2c6c5b3ea994b	Ojalá Carmen Calvo saliendo a decir “ ¿ Pero no os habéis dado cuenta ? Todo este tiempo . . ¡ el relator . . eras tú ! ” y se va volando agarrada a un paraguas .	1
04eaedde446b0e9bfd2e8de149502cd3	AUTHOR_TOKEN ¿ Y un felator ? , es decir , un relator felón	1
4459b7d49c3c555836b66b460ac0bb4a	AUTHOR_TOKEN Pero , si los pocos jóvenes que hay , no tienen trabajo , , ¿ como lo explica ? a lo mejor , necesita un relator .	1
286d3b660781ae9847a51d0bd6e34216	Mi nombre es Relator URL_TOKEN	1
1a57a2ccd048cd058f43adc3159fc19d	¿ Qué es relator ? , dices , mientras clavas en mi pupila tu pupila azul , ¡ Qué es relator ! ¿ Y tú me lo preguntas ? Relator . . eres tú .	1
d0e433e7587e257b178c50667392ecc8	AUTHOR_TOKEN AUTHOR_TOKEN Con el y su modelo de vida con yates y obesidad , amistades con famoso premio Nobel de literatura y su puerta giratoria , para que hace falta un relator ; Sabra lo que es ?	1
516213812ceeb113d85a3f4b8a65efbf	AUTHOR_TOKEN Pasa les tu una de 300 . A modo de consultor / asesor / relator / otra cosa que se te ocurra .	1
160b931568906bb7c8ed1b4b040a1551	8_de_febrero . La actualidad pasa por la figura de el ‘ relator ’ que el Gobierno quiere extender a las negociaciones con el País Vasco y los contratos que la asesora de Urbanismo de Carmena cargó a el Colegio de Arquitectos para su marido . URL_TOKEN	1
07726e92e76b18555bafb195535ff7f3	AUTHOR_TOKEN ¡ Ponga en su vida un Relator , el último modelo de extensor de pene !	1
5e8516f3e1f0ca3c0cc5018224c958aa	Me voy a llevar un relator que de fe de que le he pedido a el camarero la leche templada .	1
2f136d90565a04604cdf5ae2b50b76ea	Casado , Rivera , Abascal , Aznar , Guerra y González a Pedro Sánchez : - Es el Estado , Idiota ! Y un relator transcribió : - Es el Estado Idiota ! Y TOPIC_Ahílodejó	1
e86a175c1fa204b1e739cf4060fb401c	Felipe González ha dicho que la movida de el relator degrada las instituciones . Sí , Felipe González . Felipe González .	1
6bafb03433ef6008dc1d4d6b1a32670a	Relator de la pradera	1
8d5dd639c5925969f95fdcbf787ce1a9	AUTHOR_TOKEN AUTHOR_TOKEN Y yo que iba a proponer a Terminator porque rima con el Relator .	1
24d9518a226c54126c5fd32647507682	_ ¿ Está el relator ? Que se ponga URL_TOKEN	1
b3ce82701b0c8fafc85421219b6292ae	AUTHOR_TOKEN AUTHOR_TOKEN AUTHOR_TOKEN Con todos mis respetos . No hace falta dar categoría a esas reuniones . Con mandar a torrente como relator van muy bien servidos .	1
0fd62f42189e8945e3a0e5b7c1807bc0	Se están liando mucho con lo de Relator , Conciliador , Notario , etc . . sugiero un secretario de una comunidad de vecinos .	1
5b0e4f6d556d9b70e6e431cde453e9e6	¡ Señor , saca a el Relator de el cuerpo de esta niña ! URL_TOKEN	1
d5daf9f958a9ba658d95627252afe884	AUTHOR_TOKEN No me queda claro lo de “ relator ” . . ¿ no sera “ felator ” ?	1
ae04046de0f1e4b0db09ccf1dda6c474	Hay un método pitagorico para desvelar significados ocultos en el uso de una palabra : descomponiendo la en anagramas ; por ejemplo : RELATOR EL TORRA TROLEAR - TROLERA RELATO R ( de Republica ) LA RETRO ( el contrario de LA PROGRE ) OTRA REL ( la serie ) LA TORRE ( enroque en el ajedrez )	1
82b7571412ec71fff3fee07b98447e44	Se aproxima a la Tierra un relator de el tamaño de Tejas , señor Presidente . URL_TOKEN	1
2eacf70906f6f44f2f8001029e509087	¡ ATENCIÓN ! Se busca relator para mediar en reunión anual de comunidad de vecinos . Se valorará experiencia previa	1
f24cec7564a096d9510cbcc0caffadb6	AUTHOR_TOKEN AUTHOR_TOKEN El dictador relator , de Edgar Allan Poe . ( Y da le )	1
1f4b3b6326b7779b95771be41467cba0	Alexa , busca me un relator	1
b92efd724bb1c51564dce5d46af04c89	Busco relator para mediar entre concebollistas y sincebollistas Es para un amigo .	1
bed2b32512a9b3e143b3ccde274c5fed	Y crearemos un Relator que durará mil años ! ! ! URL_TOKEN	1
a1ef325ed3a85543290ef70d6bfc40f4	TOPIC_LaCafeteraElFelon EL RELATOR , protagonizada por Jason Statham	1
81f01c4ef160bc43daf53a0cbff998de	"Sabéis si a Relator "" le dieron algún Goya ? . """	1
1dbd9655c60aed768772b1d1d4dd1401	Una pregunta tonta : ¿ Los presupuestos no se deben aprobar si son buenos o malos para España ? ¿ Si hay relator son malos y si no , buenos ? Si hay 155 ¿ vuelven a ser buenos ? Si no ¿ malos ? ASCO DE POLÍTICA Y POLÍTICOS EN ESPAÑA ! ! !	1
c34a28675d7f79a92600d9523126a0f1	AUTHOR_TOKEN Buenas , trabajo de cara a el público y tengo experiencia de más de 10 años en calmar los ánimos , ( un conflicto en un parking es peor que el catalán , lo aseguro ) he lidiado con todo tipo de gente . He oído que busca un relator y creo que soy el hombre adecuado . Llama me	1
7c9594b6a9b6daef4b83564717fcccc3	Regla de tres simple . Si la República duró 7 segundos , el relator durará . .	1
3a63125ce2af72a3f4e5f85987322871	- . . y lo atropelló y se dio a la fuga - ¿ Pudo ver la matrícula de el relator ? URL_TOKEN	1
f6f2ac424027e1a64e6bcd739a76ff80	He lanzado un relator a el aire y no vuelan . . EMOJI_822	1
a691bb7b254dfa752f7c332a3003b433	Relator , relator , que es un relator , pues una campaña de el sector de el automóvil : Seat relator , Ford relator , Audi relator	1
f18f32bc9a46bf08dc585d553d9b333b	En la mesa de partidos con ‘ relator ’ que el TOPIC_PSOE acepta estarían : - Podemos - Bildu - PNV - ERC - PdCat - CUP - Podemos Y si no aceptas que las elecciones , los parlamentos y los resultados electorales ya no les valen , entonces es que eres un monstruo fascista y no quieres diálogo	1
34839100f889b224549e19e59726458a	AUTHOR_TOKEN AUTHOR_TOKEN AUTHOR_TOKEN Para resolver su problema , le recomiendo preparar las y acudir a las mismas asistido por un notario , un psicólogo , un médico , un genetista , un aparato de TAC y un relator . Mano de santo oiga .	1
325e49550f40c1c77c2ac89a7c2f8d24	Mis suegros quieren seguir viniendo los domingos a comer a casa Sin relator ! ! ! Ruego el amparo de el constitucional .	1
9df4a76824847f52b9c2523450fdcff2	Su padre tiene un relator extendido por todo el cuerpo . Lo siento . URL_TOKEN	1
7bbf9680779f11a7a7a6602a84fd775c	Se filtra que la obra “ Ha llegado a su localidad / el camión de el tapicero ” es , en realidad , fruto de el tesón de el relator .	1
48b204246c286cee38d95805cf63a74a	Propongo un Relator para poder recuperar los miles de millones q han saqueado en las obras de el AVE , estas de acuerdo AUTHOR_TOKEN	1
fdb7417635e1b2095762e34c76fc6552	La Gran Corrupción : DE EL ' RELATOR ' A EL ' CATALUÑA NOS ROBA ' URL_TOKEN	1
de86ea5e8970bf02256f824f96792d05	También podríamos enviar a Pablo Casado de relator entre Guaidó y Maduro .	1
24614b61a6ff37055f5752313322cb78	Di me muchacho , ¿ dónde te tocó el relator ? URL_TOKEN	1
0fef96d2e78fe61ab3c2c3807c75b0ae	- Hola , ¿ está el relator ? Es que nos falta uno en el equipo - Chaval , eres , MUY tonto URL_TOKEN	1
5d6eb3475a942bca61ccf7e3f90805b8	Buenos días . Hace sol . - - MINUTO POLÍTICO | Sánchez e Iglesias se reúnen en medio de la tormenta de el relator URL_TOKEN vía AUTHOR_TOKEN	1
b75a10d6b3d7fa60b307c1283af8ce78	AUTHOR_TOKEN Coño Iñaki , y yo que contaba contigo como Relator ! ! ! Quizas tambien contamos con los periodistas mas superficiales	1
436366fafb413f9823d3c0fab6b570f0	"Transparencia . Lo mismo tenemos ya el fichaje de el relator "" . URL_TOKEN """	1
af7fbb4f77170dfea672959e7fd53f87	Gente peligrosa AUTHOR_TOKEN Lo han vuelto a conseguir . Es salir una noticia sobre corrupción de el PP , valga la redundancia , y empezar una campaña de despiste . Hoy les presentamos el Anti-relator URL_TOKEN	1
f66231ce7c81d398736fdbc0123334b4	Qué relator ni relator . Pa relatora mi gata cuando no le damos la comida que ella quiere .	1
dc561c6242bff173b546470745ada960	“ Un relator para gobernar los a todos . Un relator para encontrar los , un relator para atraer los a todos y atar los en las tinieblas . ”	1
2b85405baacbfaa548d93233108b23b5	. . y sostengo que hubo un tercer relator . URL_TOKEN	1
22d472d62754d7fcfdf4debcfbcb14bc	"Ya sólo falta que anuncien que Otegi , el hombre de paz "" va a ser el "" relator "" . URL_TOKEN """	1
f8d51baa4e1c933a85439d535712ed06	Tener un hijo y que te salga relator	1
4e214f98363077ff18a6571ec44fc64b	Como se compra a un relator : URL_TOKEN	1
65e0077837a7d00250cfa18a3b12db13	Relator no era la última de Shane Black ?	1
7564862cb941bafbb8d3a598064eb2b1	AUTHOR_TOKEN Yo sí no hay relator no contesto	1
