id	preprotext	irony
d99428d17010deb448f38a40c7e03d87	TOPIC_semaforosA5 , que no decaiga esta tendencia , que se entere Carmena que no estamos de acuerdo los de la zona sur TOPIC_FelizMiércoles	0
18338ffaa3b9418dc6fdd092fd150a96	TOPIC_semaforosA5 7:52_De_la_mañana atascazo . URL_TOKEN	0
85de318e32c9a5e45cb85dc33cc37903	TOPIC_ProtocoloContaminación AUTHOR_TOKEN Cual es la excusa a parte de intentar ocultar lo de los TOPIC_semaforosA5 ? URL_TOKEN	0
0e7075b98bb6a2c3d28b7d80a3101978	TOPIC_NoLoOlvides TOPIC_Ciudadanos no se opuso a los TOPIC_SemáforosA5 , hace 2 años se abstuvo . TOPIC_A5tascazopodemitA5 URL_TOKEN	0
493803d702ce30f050bee40b817d7ffc	TOPIC_NOaLosSemáforosDeLaA5 TOPIC_MásAtascos TOPIC_MásContaminación TOPIC_CaosCirculatorio TOPIC_SemáforosA5 TOPIC_MomentosPlenosNavalcarnero TOPIC_DefiendeTuMunicipio TOPIC_Navalcarnero NAVALCARNERO : EL MUNICIPIO MÁS PERJUDICADO POR LOS . . URL_TOKEN	0
4aa61cd719d59fa8a0c3ef8468fc82b6	TOPIC_myhyv TOPIC_FelizMiercoles TOPIC_semaforosA5 TOPIC_LaCafeteraVatileaks TOPIC_GHDUO27F TOPIC_GHDÚOLímite7 TOPIC_GH TOPIC_Oscars TOPIC_ElClasico TOPIC_VamosTigres AUTHOR_TOKEN URL_TOKEN	0
a996c2e416e2bbe3b3f196dcbabb42c8	TOPIC_MWC19 TOPIC_FelizMiércoles TOPIC_GHDUO27F TOPIC_LaCafeteraVatileaks TOPIC_JAnuario2019MAD TOPIC_semaforosA5 ¿ Nos dan miedo los ascensores ? La claustrofobia se puede superar , siempre y cuando no sea a la vida URL_TOKEN	0
b28f0ae9a12ca298db83734620f067ee	TOPIC_granpitadaelmartes TOPIC_granpitadaelmartes TOPIC_granpitadaelmartes TOPIC_granpitadaelmartes TOPIC_semaforosA5 TOPIC_A5VíaUrbana AUTHOR_TOKEN AUTHOR_TOKEN AUTHOR_TOKEN AYUDAR NOS	0
496b8bc3c0b337502882321a7f5115ff	TOPIC_GranPitada el martes 26/02 . NO a la TOPIC_antimovilidad de Carmena NO a los TOPIC_semaforosA5 Todos el martes pitando con nuestros claxon TOPIC_GranPitada AUTHOR_TOKEN AUTHOR_TOKEN AUTHOR_TOKEN AUTHOR_TOKEN AUTHOR_TOKEN URL_TOKEN	0
ce5f43c326ae92e59ce7080b9797f1df	TOPIC_GramPitada el martes 26/02 . NO a la TOPIC_antimovilidad de Carmena NO a los TOPIC_semaforosA5 Todos el martes pitando con nuestros claxon TOPIC_GranPitada URL_TOKEN	0
58a216bbf516a0351ae1ca01a9449762	TOPIC_AvisoImportante TOPIC_Tráfico TOPIC_EntradaEnVigor TOPIC_SemáforosA5 TOPIC_CarrilesBusA5 TOPIC_Navalcarnero LA ENTRADA A MADRID POR LA A - 5 ESTRENA HOY MARTES SEMÁFOROS Y DOS CARRILES BUS . - La polémica transformación de la . . URL_TOKEN	0
f9be0ac89437e36348b0c16a3477edc9	TOPIC_atasco TOPIC_madrid TOPIC_a5 TOPIC_semáforosa5 medidas populistas de los impresentables de TOPIC_carmena y sus secuaces . en Madrid , Spain URL_TOKEN	0
051e0495315a088a01978242d8fe2807	TOPIC_a5NOViaurbana TOPIC_fueraSemaforos TOPIC_semaforosA5 TOPIC_movilidadSI TOPIC_dejarDeMentiryMaquillar URL_TOKEN	0
d739a03a8d0a152a51f3ffbf32040118	TOPIC_a5NOViaurbana TOPIC_fueraSemaforos TOPIC_semaforosA5 TOPIC_movilidadSI TOPIC_dejarDeMentiryMaquillar URL_TOKEN	0
a19e4f07596b060f16f18d56138bdbc5	AUTHOR_TOKEN AUTHOR_TOKEN Asoma te ahora , las 20:10 , que el atasco llega a la Ciudad de la Imagen , advertido además por la comunicación de la DGT TOPIC_SemáforosA5	0
8f33966e683e29d1fce52a9e4f883611	AUTHOR_TOKEN AUTHOR_TOKEN AUTHOR_TOKEN AUTHOR_TOKEN AUTHOR_TOKEN AUTHOR_TOKEN AUTHOR_TOKEN AUTHOR_TOKEN dejar ya de mentir . Hasta la semana pasada , la ruta más corta y rápida era TOPIC_a5 y TOPIC_m30 . TOPIC_a5NOViaurbana TOPIC_semaforosA5 TOPIC_madridgueto	0
a7bfd90dd8a0c151d863bf4cf67aa1e3	AUTHOR_TOKEN Y tienen la cara dura de decir que todo ha ido bien , prensa , asociaciones , personajes . . TOPIC_a5NOViaurbana TOPIC_fueraSemaforos TOPIC_semaforosA5 Incluso dicen que es mejor que hagamos 20kms más . .	0
5e249384278510cec4e849a56575e920	AUTHOR_TOKEN AUTHOR_TOKEN AUTHOR_TOKEN AUTHOR_TOKEN Madre mía pero que es esto ? No hay que ser muy listo para ver la que se va a montar con los TOPIC_semaforosa5 vais a joder a muchos obreros que os votan y a muchas familias que llevan a sus hijos a el cole .	0
b80e21490b08f54da3baf056f7a0f1f1	AUTHOR_TOKEN AUTHOR_TOKEN AUTHOR_TOKEN AUTHOR_TOKEN AUTHOR_TOKEN AUTHOR_TOKEN AUTHOR_TOKEN AUTHOR_TOKEN Estas son las fotos de la vergüenza . . cuanta demagogia y que poco civismo TOPIC_semaforosA5 TOPIC_A5ViaUrbana URL_TOKEN	0
ba5209573971446e31925a8c3f8bb42b	AUTHOR_TOKEN AUTHOR_TOKEN AUTHOR_TOKEN AUTHOR_TOKEN AUTHOR_TOKEN AUTHOR_TOKEN AUTHOR_TOKEN AUTHOR_TOKEN AUTHOR_TOKEN Y ahora qué ? iluminados . . el atasco llega hasta Móstoles . . Quitaré el start & stop para proteger mi motor y que así disfruten de nuestros malos humos TOPIC_pitadaA5 TOPIC_semaforosA5 URL_TOKEN URL_TOKEN	0
e8c2b17281f703aece50d0b011e6099b	AUTHOR_TOKEN AUTHOR_TOKEN AUTHOR_TOKEN AUTHOR_TOKEN AUTHOR_TOKEN AUTHOR_TOKEN AUTHOR_TOKEN AUTHOR_TOKEN AUTHOR_TOKEN Vas a echar una mano a las personas de los 3 accidentes que casualmente hay en el tramo afectado por los TOPIC_semaforosA5 ? Quizá no sea casualidad y sea una CONSECUENCIA . . URL_TOKEN	0
74e42350b8b073830f8c275a58be8899	AUTHOR_TOKEN AUTHOR_TOKEN AUTHOR_TOKEN AUTHOR_TOKEN AUTHOR_TOKEN AUTHOR_TOKEN AUTHOR_TOKEN AUTHOR_TOKEN AUTHOR_TOKEN Claro , como tienes la verdad absuluta sabes que ha sido porque van con el móvil . . lo mismo ha sido porque han dado la vuelta a la cinta de cassette . . 🤦 EMOJI_55 ‍ EMOJI_709 ️ pues simplemente los TOPIC_semaforosA5 son una mala decisión que sólo traerán problemas para TODOS , así de simple .	0
28456ee3973a8ae7dc5ef76fd9b861c2	AUTHOR_TOKEN AUTHOR_TOKEN Como dijo una persona esta mañana , y aunque no os lo creáis , hay vida más allá de Móstoles . Y no llega el metro ni el autobús , . . TOPIC_semaforosA5	0
efc6417fe1d68a275e68fbdb8a4fd4e4	AUTHOR_TOKEN AUTHOR_TOKEN AUTHOR_TOKEN Ejemplo de cómo se puede convertir en calle una autopista . TOPIC_A5ViaUrbana TOPIC_semaforosA5 URL_TOKEN	0
aea2377880840d51aeb853164037d5e7	AUTHOR_TOKEN Es cierto que cierto que se esta organizando una gran pitada por los TOPIC_semaforosA5 a la altura de campamento AUTHOR_TOKEN ?	0
663effaed03140e69c192802abafe3f2	Lo que pasa aquí es que el de la izquierda defiende que la tierra es plana y el de la derecha defiende que es redonda . URL_TOKEN	1
698febf8039bb94f2f73d8ec395249f4	¿ Tú no qué ? ¿ Sin sexo o que no piensas que la tierra es plana ? EMOJI_769 🤣 URL_TOKEN	1
0f7c9766843a9f3ac350a0614a08cfe6	Hola AUTHOR_TOKEN , ¿ para cuándo un Google Earth para tierraplanistas ?	1
266e5d8701f79f41dc03dbb2523dfc94	AUTHOR_TOKEN Eso de el cambio climatico son patochas la tierra es plana EMOJI_262	1
e358f2b28962e1aae0964085e1bba827	AUTHOR_TOKEN La Tierra es plana . Rajoy dixit .	1
cd5060fcb461105153e52ff2532dc598	Arrimadas yendo a la Basílica de la Santa Cruz de Florencia a decir le a Galileo que la tierra es plana .	1
b1a079fec20382242eb36c317f57e971	AUTHOR_TOKEN Es fácil : vas hasta el límite de la tierra plana , te asomas a el borde y lo preguntas a la tortuga que hay debajo , sosteniendo a el mundo .	1
54a559a80aff2f6c120f731b76055619	AUTHOR_TOKEN Todo el planeta sabe que lo de Pepe es roja . Todo menos un pequeño reducto de tierraplanistas .	1
e16c167e54dbc8bf0aca06ca69fbeb81	AUTHOR_TOKEN AUTHOR_TOKEN Yo si ademas decretan que la tierra es hueca y plana . . les voto .	1
38be61fd2adc17db7c721ced37e4b8ae	AUTHOR_TOKEN AUTHOR_TOKEN AUTHOR_TOKEN Cuando se den cuenta que la tierra es plana en dos dimensiones , esferica en 3 y una hyper esfera en 4 . .	1
7f05d67ae7f86d43d803d07bab1d9fce	Por ejemplo , uno podría creer en tonterías como la tierra plana o la brecha de género . Eso es motivo para que no pase la entrevista .	1
42aa17b4a359767fd3e2c4907dcaedbf	Una vez leí el contraargumento para terraplanistas que si la Tierra fuera plana , los gatos ya lo habrian tirado todo por el borde . . URL_TOKEN	1
71f4afda2c1afea3c39b8472ea95f801	AUTHOR_TOKEN Todo el mundo sabe que la tierra es plana y se sostiene sobre cuatro elefantes a lomos de una tortuga . Esperemos que nos toque arriba cuando decida aparear se . . URL_TOKEN	1
a50865361bea3f3c039b08ff141c9cd2	El mejor ejemplo d q la tierra es plana está en q no existe una foto d pie y boca abajo d los q están en el hemisferio sur . Ahí lo dejo ! TOPIC_LaTierraEsPlana	1
fdd8319107ec61828a98996a4192b230	Otra evidencia d q la tierra es plana es q no hay rios en el hemisferio sur q suban para arriba . TOPIC_LaTierraEsPlana	1
66cec1516074dbe27228ca145a610b03	Como la gente se crea esto , va a ser peor que creer se que la tierra era plana URL_TOKEN	1
9eaa7b102310382bbfe2eaeed59d7bde	Alguien me dice que la tierra es plana y que la redonda es un invento capitalista y no me va a extrañar , lo juro .	1
7b5461c26adeb2cc8a7ba6da7a95e387	no nos vengas con la excusa de el materialismo ni marxismo ni mierdas q tengo capturas tuyas afirmando la existencia de l … — vale me has pillado la tierra es plana y una simulación ya está lo he dicho detengan me pinches furros URL_TOKEN	1
f660f410cdef3271ed67d3ffb54c9b16	- Señora Sáenz , la Tierra es plana o triangular ? + Mire , la Tierra es redonda . - Señoría , es que la testigo no quiere contestar a mis preguntas JOO Y así han estado un rato . Ahora además el testigo es gallego . . Nos vamos a reír .	1
47cdf5dc26e3de3be24b5aa803b67071	Por favor , q vuelva el Santo Oficio y queme a el q afirme q la tierra es plana , jahahahaha	1
bdb5ed05be1bb98271d33df009cc9739	Entre el documental de la tierra plana y el día que he tenido hoy en el trabajo de verdad que voy a acabar con una embolia fruto de el enfado .	1
55e18bd01051012007097ca69b3e98d4	Los políticos de el “ pruses ” son a el derecho , lo que los tierraplanistas a la ciencia . De tan absurdo , no se puede ni rebatir .	1
2add0ea42c27fd9741039bf77a6fcb10	¿ Seguro que AUTHOR_TOKEN sabe que la tierra no es plana AUTHOR_TOKEN , no es un concepto demasiado moderno para una mujer de el Siglo_XII ? URL_TOKEN	1
eb49bb9fb05e4f260f699126df2207b7	AUTHOR_TOKEN AUTHOR_TOKEN La luna no existe , es una conspiración de la nasa para que nos olvidemos de que la Tierra es plana EMOJI_769 EMOJI_769 EMOJI_769	1
f0020b1fb3e2e4d4c8503cf6cd8290a2	AUTHOR_TOKEN AUTHOR_TOKEN Tranquilo , todo es más fácil , la tierra es plana URL_TOKEN	1
68310ec0156bc2035f8517ac132a24f0	AUTHOR_TOKEN La tierra es plana . La tierra es plana . La tierra es plana . La tierra es plana . La tierra es plana . La tierra es plana . Son flatearthers . Somos una democracia . Somos una democracia . Somos una democracia . Somos una democracia . Somos una democracia . Son españoles .	1
451ebe4d3e182269175b7a352d528f06	Pues nada , resulta que hay gente que cree que Australia no existe y que es una invención de la CIA para ocultar que la tierra es plana . Yo la verdad es que ya no se que pensar 🤣	1
bc54bbe3f5f2661e274178cc37be07e5	La mayor prueba de que la tierra no es plana es que los terraplanistas aún no se han caído por el borde	1
d00f58f1b2a7b28436713b8bed218603	Gente en 1900 : En el año_200 habrá coches voladores Gente en 2019 : La tierra es plana	1
80c249082eb6160cee5d341f1971b305	"AUTHOR_TOKEN El primo de Rajoy era todo un negacionista , seguro que pensaba que la Tierra es Plana . Y Rajoy , decía : eso es como el agua que cae de el cielo sin que se sepa exactamente por qué """	1
0ad863c9224dedc66efc1b749df4fe24	"Después de ver el documental de AUTHOR_TOKEN de La tierra es plana "" me pregunto . . Por que a esta gente no se les encierra ? Pero en una biblioteca me refiero . """	1
8503ad2736c862584e43626eaad7822f	AUTHOR_TOKEN La tierra es plana , lo dijo AUTHOR_TOKEN	1
9c85eab531834fbd1bf5a1c3599cb905	Coño , si se gana dinero en youtube diciendo que la tierra es plana	1
6429b291c44c41e6c8a98cfc03200787	"AUTHOR_TOKEN AUTHOR_TOKEN AUTHOR_TOKEN ha dicho Hice la Tierra redonda porque si la hubiese hecho plana sois tan tontos que os habríais caído por el borde . "" con lo cual se invalida vuestra idea de que la tierra sea plana . """	1
9b9d9ebc69b5ab2a878c8f2f68724a29	TOPIC_MVTRajoyDeclara en su línea . . no hubo referendum . . la tierra es plana . . y elvis vive en santa pola , donde el registra no se qué a no se quién . . URL_TOKEN	1
5f1113a36c81f447ddf318e4d21afe47	Qué se fuma la gente que cree que la Tierra es plana ? Yo quiero un poco	1
0392c405de225eff22f6ceb352cc1ee3	AUTHOR_TOKEN Yo ya sabéis que soy firme defensor de el platanismo que crearon los Monty Phyton . Ni hueca ni plana , nuestra Tierra es un plátano 🍌 , que por algo tiene tanto potasio EMOJI_769 EMOJI_769	1
295b09809c1706447f259b28df2f1a32	Me veo en la obligación de informar les que la tierra no es plana . Encontrarán a otros como ustedes más a el norte , y también a el S , a el E y a el O . TOPIC_ApuntaMiNombreV0X	1
872c5a17108976447693fce31f1d2401	AUTHOR_TOKEN Claro . La tierra es plana y lis chimpancés verdes	1
adb15ef95755e9b4830ca00764eec142	AUTHOR_TOKEN Estos seguro que piensan que la Tierra es plana . . URL_TOKEN	1
940483b2d193d9a623eb1b055134cf47	AUTHOR_TOKEN Politologa y profesora universitaria . . Y haces este tuit ? La tierra es plana Astrid y Dios creó a el hombre con un trozo de barro . Toma te dos copas más .	1
c52926a6df6fcf618f87a7b86389d5f8	Si la tierra fuera plana se habría caído con el lado de la mantequilla hacia abajo	1
d810a4898775bbe4856181a00aafbed0	AUTHOR_TOKEN AUTHOR_TOKEN AUTHOR_TOKEN Ya , y la tierra es plana .	1
e9ec2a8254cf5f2f9a059ba70158daaa	"AUTHOR_TOKEN si tienes Netflix te recomiendo la tierra es plana "" explica muchas cosas sobre el éxito de el independentismo """	1
1004e9683fcffcddda0b1433937ba8d0	¿ Sigue siendo la Tierra Plana , AUTHOR_TOKEN ? Porque me encantaría saber cómo emitís desde el satélite URL_TOKEN	1
cf966449171c53a6c6b0f0197c009a0e	¿ Veis ? Un divulgador científico serio reconociendo POR FIN que la tierra es plana . . Porque algo redondo es algo plano . Queda confirmado . . ¡ que el que tiene boca se equivoca ! ( Grande , Alex , sigue así , que se aprende mucho de ti . . ¡ y perdona la broma ! ) . URL_TOKEN	1
30884f8bda5f8630f28decf1f08d4997	La Tierra no puede ser plana , porque los que viven en los bordes no mandan fotos .	1
5cb68469a4520d0e2ebe29e83cc8bc95	Cuándo te dicen que la Tierra es plana y la lejía es buena URL_TOKEN	1
87567cdad49241cd4e78362ae8637821	Vosotros creeis que Sergio Ramos y Carvajal son tierraplanistas ?	1
7ef328523fbd11ade17934c9781851f1	AUTHOR_TOKEN AUTHOR_TOKEN La tierra no es plana , tiene forma de puro	1
9d304ca5658570464aabdef089c03aff	Yo a veces creo que los magufos de el mundo tienen la misión intrínseca de hacer nos reír : - Azúcar que cura - La Tierra es plana y / o hueca - Mercados solos se auto-ajustan - Hay inmateriales por ahí - Hitler no se suicidó y vivía en Brasil - El alunizaje fue grabado por Kubrick	1
cde590700e738913dfea7c30b75b287b	Madridistas que se quejan de el calendario . A estos borregos les dices que la tierra es plana y lo defienden a capa y espada . URL_TOKEN	1
f2952d2d30997b6e79f52992782b352f	Si lo ponéis en horizontal os daréis cuenta de que efectivamente La Tierra es plana URL_TOKEN	1
958742e0c92c9f7cd549048beebc9de5	AUTHOR_TOKEN Parece más lista que Talegón , que está a el borde de creer que la Tierra es plana .	1
a4a2188be024ca803ded76a06728d417	"Me estoy viendo la la tierra es plana "" y estoy como cuando vi el primer capítulo de The Office"	1
d3ba2102dc0dc4713ed221dabb1375e9	Todo el mundo sabe que la tierra es redonda y que gira alrededor de el Sol . Bueno , casi todo el mundo . URL_TOKEN URL_TOKEN	1
15f478eee5e362b45de710e5a63eb8cb	AUTHOR_TOKEN AUTHOR_TOKEN Pero son los únicos inteligentes de el mundo . Solo ellos ven las bondades de el modelo Madrid . Los demás somos imbéciles , parece ser . Y la ciencia . Y la realidad . Todos van contra el modelo Madrid , el único que de verdad te hace libre . Y la Tierra es plana y la homeopatía funciona	1
db8d729817d488fdeae4cfbe0de49808	AUTHOR_TOKEN Porque , aunque solo sea en tu imaginación , esa gente existe . Las bicis son las reinas de Madrid . La homeopatía funciona . Ya Tierra es plana . Que nadie te convenza de lo contrario	1
93763b9f15b7b09e3c85eb808dd04520	AUTHOR_TOKEN AUTHOR_TOKEN Ahora todo tiene sentido , la Tierra tiene que ser plana porque diosito siempre mira desde arriba	1
f52b7a22ce59d4deb78ee2db50a8d7f8	Hace poco vi el documental de Netflix que dice que las endodoncias son malas y que el circonio no es un metal EMOJI_769 . Hoy es el turno de los tierraplanistas . 🤦 🏼 ‍ EMOJI_699 ️ 🤦 🏼 ‍ EMOJI_699 ️ 🤦 🏼 ‍ EMOJI_699 ️ 🤦 🏼 ‍ EMOJI_699 ️	1
c8bdef78055e50062391274691d169a0	AUTHOR_TOKEN Y los aviones nos fumigan , y la tierra es plana , y las vacunas no sirven . .	1
bfafebbb533535dc6a42cdfa77869e8e	Gracias a los que van a fletar un crucero para demostrar que la tierra es plana , y a el renacer de los anti-vacunas , a Thanos no le va a quedar mucho trabajo por hacer aquí . URL_TOKEN	1
678ab23986e195b9c733e8dbcd7fab19	Llevo 10 minutos de el documental de los tierraplanistas y aún no se como me siento	1
db0035995bee6dccfadfe93e59a507f6	"AUTHOR_TOKEN AUTHOR_TOKEN AUTHOR_TOKEN AUTHOR_TOKEN Que unicoos cobra de la CAM "" es mentira . Y la tierra no es plana ."	1
bfccdadf10391d3543c1d16db8bc7584	AUTHOR_TOKEN AUTHOR_TOKEN AUTHOR_TOKEN AUTHOR_TOKEN Y la tierra es plana , putas conspiraciones	1
737977909b767d8e2bdf24780edc6aea	AUTHOR_TOKEN Porsupuesto que la Tierra es Plana y no Gira . Punto .	1
9037f4da8fa294de1bf33c0fcbd44084	AUTHOR_TOKEN AUTHOR_TOKEN AUTHOR_TOKEN AUTHOR_TOKEN AUTHOR_TOKEN Si , y la tierra es plana	1
5b9db936e472c15cb55f77c40f7ccc10	2011 , una primavera estupenda . 2015 , una primavera estupenda . 2019 , una primavera estupenda por adelantado . ¿ Por qué siempre que hay elecciones en primavera hace buen tiempo ? Seguro que los tierraplanistas tienen respuesta . Los políticos aumentan la potencia de la bombilla solar .	1
2bdff1b7aafac48cb4479339c53e257b	Estoy viendo el documental de TOPIC_netflix : La Tierra es plana . QUE MALOS CHOIS LOS CHIENTIFICOS ( voz de Broncano ) .	1
41bb6898c2205552005a6cd1e4b4cd7e	AUTHOR_TOKEN Por esa regla de tres , yo creo que la Tierra es plana	1
27f0d9e5ac23ee77b6f3b2f8a4b24b6a	AUTHOR_TOKEN AUTHOR_TOKEN Y eso que la tierra es plana jaja	1
b638f2051893151c4d67d0bc595a899b	AUTHOR_TOKEN Creo que ha sido generalizado . No sé , alguien habrá tocado algo y ha subido el nivel de dificultad . A el final será cierto que la Tierra es plana . . y va a lomos de cuatro elefantes sobre una tortuga .	1
a4964d2747ccafde2115a5f4feda3627	AUTHOR_TOKEN ¿ Qué circunferencia ? La Tierra es plana y Eratóstenes un camelista	1
2276f6dbd33d1890d2b40ecbcc2c1c43	Si estan buscando algo cómico en netflix : Behind the curve . Un documental sobre gente que piensa que la tierra es plana .	1
e351a9c17b11923789e63419eb65bcbd	Lo malo de pedir un par de días libres es que acabas viendo El Padrino otra vez , y un documental en Netflix sobre los que creen que la Tierra es plana . . y acabas deseando llamar a Luca Brasi . URL_TOKEN	1
95b02d909af8483df6f1d259af528b8a	AUTHOR_TOKEN AUTHOR_TOKEN Y la tierra es plana , y somos el centro de el universo y Dios existe . EMOJI_769 EMOJI_769 EMOJI_769	1
71240373adb0cadbde4e3a6e25b8317f	He terminado de ver un documental sobre los tierraplanistas y lo cierto es que me ha hecho cambiar de opinión . Ahora pienso fehacientemente que la gente es GILIPOLLAS .	1
997c668907a3bd63c80f1030de4c8faa	No me negaréis que la campaña electoral de Pedro Sánchez le está saliendo redonda . Da igual que su libro sea una mierda , o que sólo diga idioteces . Existe una fuerte correlación entre que hablen de ti y ser votado , y ya puedes decir que la Tierra es plana .	1
8eac02116c00c950e2e1f3558a601b62	AUTHOR_TOKEN AUTHOR_TOKEN AUTHOR_TOKEN AUTHOR_TOKEN AUTHOR_TOKEN País Valencià , lengua Valenciana es catalán , la república catalana , presos politicos . . no pretenderás que se te tome en serio con todo lo que pones . . lo siguiente es que vivimos en Matrix o que la tierra es plana . . o que todos descendemos de un catalán URL_TOKEN	1
9dbd57176165ff487d501755c9a08848	A ver , partimos de la base de que todavía hay gente defendiendo que la Tierra es plana . No sé por qué os sigue sorprendiendo cualquier ápice de involución en nuestra especie .	1
4ff59bbc64b6b4fd246b17be5a7500cc	Empezamos haciendo campaña contra las vacunas y acabamos creyendo que la tierra es plana y votando a Vox .	1
356a6ab7b52b51ad1f3fc4a6c5104914	"AUTHOR_TOKEN En verdad los científicos y astrónomos tienen poco que hacer , el tema es gente como Trump que de los creadores de la tierra es plana "" llega "" el cambio climático no existe "" . """	1
792789ede0bfbf89aa11268f1fb52712	Algún día tengo que leer me las PRUEBAS IRREFUTABLES de porque la tierra es plana o porque las vacunas son malas	1
f3a7adba12558fefd5cb5eb18f8b92ac	“ Unos ven la tierra plana y otros la ven redonda , es que cada mente comprende según su forma . ”	1
a5f7c1c0d91e10a3a3e55fe66ce68063	La Tierra era plana pero está operada .	1
45f171d985f451c6faf57fe6b2faa43f	negar que el Madrid ha jugado mejor es como afirmar que la tierra es plana	1
3042e9ed089baf66a9c7b5a1eee7567e	Aquí hay un artículo infumable de un listo muy tonto que ha visto el docu de La Tierra es Plana y NO HA ENTENDIDO NADA . URL_TOKEN	0
b18382c9cffd274229c3b0aba1b976ef	"El final de el documental La tierra es plana "" en Netflix es brutal 🤣 """	0
ed0702178e2a2420e542c1ccf182c888	AUTHOR_TOKEN Pues cuando le cuente q en USA todavía hay gente que creé q la tierra es plana , le da un yuyu .	0
ce63792d2f0429c79eb3d7f2d3594962	El documental de los tierraplanistas de Netflix es antológico	0
1b91d61228898184adc3f6e706803b28	en netflix hay un documental sobre tierraplanistas voy a ingerir lo que flipas	0
2062b36c6ac31447c2e344b1ab6b1abd	AUTHOR_TOKEN Son los mismos que dicen que la Tierra es plana , ¿ no ? EMOJI_769	0
385ce03d9743f89e7829382495cd7a23	AUTHOR_TOKEN AUTHOR_TOKEN Y dice que la tierra es plana	0
7a5007901891210a2f15238f38767cce	AUTHOR_TOKEN Ay , Diosas , que creo que para el tío de la tierra plana , deGrasse Tyson es Voldemort o algo ! ! ! ( no puedo agradecer te lo suficiente el que me hayas descubierto esta joya ! ) URL_TOKEN	0
f2879d4db7801794f094993c9f29ddb2	Terraplanista descubriendo que la tierra no es plana : “ Interesante ” URL_TOKEN URL_TOKEN	0
d853b4aef6eb9ccd6feda98cf6b20a71	' La Tierra es plana ' : el documental sobre los terraplanistas es un deleznable ejercicio de humillación URL_TOKEN URL_TOKEN	0
7f8914e65b1933cfd1b8b89b56d1936b	Cómo humillar a un terraplanista : ' La Tierra es plana ' de Netflix es una oportunidad perdida para entender el problema URL_TOKEN	0
6eb2a34c323ef72b964507e8e47b7f7a	AUTHOR_TOKEN complejo camino la de la regulación . . suguiente : la tierra plana , homeopatía . . no sería mejor más labor pedagógica	0
8aea76c8c7a432ffb5120569683652a3	LA TIERRA ES PLANA URL_TOKEN	0
52fe1992a5042059fbae7f577218699a	AUTHOR_TOKEN No es solo decir “ esto no me gusta ” es ya defender una postura de “ la tierra es plana ” cuando esta claro que es completamente erronea pero ellos por dar por saco dicen que no . A ese nivel estamos	0
1ba5b0918d4e1d9a93ecc7ffe3dcd268	De verdad que los tierraplanistas me encantan	0
cfde363a35cbbebbd9e29a02b51ea1d1	AUTHOR_TOKEN AUTHOR_TOKEN AUTHOR_TOKEN AUTHOR_TOKEN Mire si vamos a discutir si la Tierra es plana y el Sol gira alrededor de ella , nos vamos a el plano de los dogmas de fe , el dogmatismo no me interesa , suelo analizar la realidad de la forma más objetiva posible y lo que usted me dice es puro dogmatismo no basado en realidad alguna	0
07dbd8f201c7034bf751837cbf1e95ff	AUTHOR_TOKEN Dani que dices ? Cómo puedes decir que la tierra no es plana ? Ya hablaremos de esto .	0
fa6bde5b0f8a86a4c4daa24d353ebd2b	AUTHOR_TOKEN Tierraplanistas	0
73c9a2eebce36d275772e13edc66a638	Me parece impresionante que estemos en el año_2019 y hay gente que dice que la tierra es plana . Y que niega la gravedad . Chicos los científicos fueron perseguidos por decir la verdad y ustedes vienen con estas pelotudeces , paren un rato de querer llamar la atención .	0
dad5e1efad66829a5841ed0dc691b5c9	AUTHOR_TOKEN AUTHOR_TOKEN AUTHOR_TOKEN AUTHOR_TOKEN AUTHOR_TOKEN Puedes deducir lo que quieras , que si te lo explican y sigues pensando lo que te dé la gana puedes hasta creer que la tierra es plana . Te he explicado que en ningún sitio Torra dice lo que tú piensas , pero sigues enrocado . Allá tú .	0
a9f46dfe12507735c1062faa5b6eedf6	Abro paraguas pero Irving no es un líder , un tío que hace de actor en sus tiempos libres , piensa que la Tierra es plana y que entrena a chavales en una pachanga . Por no hablar de el zorreo que se va a traer en FA .	0
d0eab0072538e7cbde9d6822e85f6998	AUTHOR_TOKEN Bueno lo que te digo es cierto . Aunque la Tierra fuera plana ( que no lo es EMOJI_283 ) la luz no sería perceptible a una distancia infinita .	0
cc1b096e8886307503de32fac22c956e	AUTHOR_TOKEN Si la Tierra fuera plana solo se me ocurre que la propia luz se curvara por la fuerza de gravedad y por eso a el aumentar la distancia hay que aumentar la altura de el faro .	0
9bd8d70cb82dc19f48060e601bd90ffa	AUTHOR_TOKEN AUTHOR_TOKEN Mentiras en vuestro universo burbuja . Los tierraplanistas también piensan que hay una conspiración contra ellos .	0
a8b6b716023b919747e183f86abd849c	"Los que tengáis Netflix , echad le un ojo a el documental La tierra es plana """	0
3cdb382154a6dea1a164646cd0aee271	Cinco sencillas formas de demostrar que la Tierra no es plana - URL_TOKEN	0
1e8bf516edd0cb8e08cd22009e07989f	5 SENCILLOS EXPERIMENTOS PARA COMPROBAR que la TIERRA NO es PLANA URL_TOKEN URL_TOKEN	0
5b5a5d8e8e25867d3eac68ff3666dbe5	' La Tierra es plana ' : el documental sobre los terraplanistas es un deleznable ejercicio de humillación URL_TOKEN URL_TOKEN	0
fbd381c67118f582fb029e92838ebe9e	' La Tierra es plana ' : el documental sobre los terraplanistas que ha llegado a Netflix es un deleznable ejercicio de humillación URL_TOKEN	0
